langue,marque,description,meta_description
en,Eclipse/Neill,"Eclipse/Neill has a storied history that dates back to the early 20th century, rooted in a commitment to quality craftsmanship and innovation. Founded in the UK, the brand has dedicated itself to providing professional-grade tools designed for both tradespeople and DIY enthusiasts. Their mission is to enable users to achieve precision and efficiency in every project, upholding the highest standards of performance.

The range of tools offered by Eclipse/Neill reflects a deep understanding of the needs of their customers. Their collection includes a variety of hand saw blades, including TPI hand saw blades in multiple sizes, as well as specialized tools like pull saws and junior hacksaw blades. Additionally, they provide a selection of mechanic's vises, designed for strong, reliable clamping in various applications.

One key fact about Eclipse/Neill is their emphasis on continuous improvement and adaptation. Throughout their long history, the brand has evolved by investing in modern technology and materials, ensuring that they remain at the forefront of tool innovation without compromising the durability and safety that their customers have come to trust.","Discover high-quality Eclipse/Neill tools at Outillage Placide Mathieu. From precision hand saw blades to versatile pull saws, we have everything you need for your cutting projects. Enhance your craftsmanship today! Visit Placide.com."
en,Eklind,"Eklind is a storied brand that has been at the forefront of precision tool manufacturing since its inception. Founded with a mission to provide durable, high-quality tools for both professionals and DIY enthusiasts, Eklind emphasizes craftsmanship and reliability. The brand's commitment to excellence not only demonstrates its dedication to the craft but also reflects the evolving needs of its customers, ensuring that each product embodies integrity and performance.

Eklind specializes in a wide range of hex wrenches and drives, particularly well-known for their ""T""-shaped hex wrenches. These tools are designed with user comfort and functionality in mind, featuring ergonomic handles and a robust construction that ensures ease of use across various applications. Whether for assembling furniture, repairing machinery, or tinkering in the garage, Eklind tools provide the precision needed for repetitive tasks and projects requiring intricate adjustments.

One remarkable fact about Eklind is their commitment to American manufacturing. By producing their tools domestically, they not only assure quality control but also support local economies and maintain a sustainable production process. This dedication to local craftsmanship allows Eklind to guarantee the reliability and durability of their products, making them a trusted choice for those who demand excellence in their tools.","Discover high-quality Eklind tools at Outillage Placide Mathieu! Our selection includes durable hex end ""T-shaped"" hex wrenches designed for precision and ease of use. Perfect for any project, big or small. Visit Placide.com for more!"
en,Empire Level,"Empire Level has a rich heritage dating back to its establishment in the early 20th century, driven by a simple mission: to provide precision measuring tools that enable professionals and DIY enthusiasts to achieve exceptional accuracy in their projects. With a commitment to quality and innovation, Empire Level has established itself as a trusted name in the field of measuring and layout tools.

The brand offers an extensive range of products designed to meet the diverse needs of its users. From carpenter squares and combination squares to sliding T bevels and contour gauges, each tool is engineered for durability and precision. These essential instruments help ensure that every cut and measurement is spot-on, making them invaluable to carpenters, contractors, and hobbyists alike.

One notable aspect of Empire Level is its dedication to producing tools in the United States, which not only supports local jobs but also allows for stringent quality control. With a focus on craftsmanship and reliable performance, Empire Level continues to innovate and expand its product line, maintaining its reputation as a reliable partner in the construction and woodworking industries.","Discover high-quality Empire Level tools at Outillage Placide Mathieu! Our selection includes carpenter squares, brass star gauges, and more, perfect for all your measuring needs. Elevate your projects with precision. Visit Placide.com for more!"
en,Empire level,"Empire Level has a rich heritage rooted in precision and quality, having been established to provide professionals and DIY enthusiasts with reliable tools for over a century. The brand's mission has always centered around innovation, ensuring that each product delivers unmatched accuracy and durability, ultimately empowering users to achieve their best work.

The extensive range of tools offered by Empire Level includes digital levels, box levels, and a variety of measuring tools designed to meet the needs of both construction professionals and home improvement projects. Products like the 24-inch digital level and the 48-inch digital box level exemplify their commitment to advanced technology and robust design, allowing users to take on challenging tasks with confidence.

An interesting fact about Empire Level is their dedication to continuous improvement through customer feedback and technological advancements. This approach not only enhances the user experience but also ensures that each new product reflects the real-world demands of those who rely on their tools day in and day out, making them a trusted partner in building and renovation projects.",Discover precision and quality with Empire Level tools at Outillage Placide Mathieu. Elevate your projects with our premium digital levels for accurate measurements and reliable performance. Visit Placide.com.
en,ENERGIZER,"Energizer has a rich history rooted in innovation and reliability, having emerged as a leader in power solutions since its inception. With a mission to deliver dependable energy, Energizer focuses on enhancing everyday experiences through cutting-edge battery technology. The brand's commitment to sustainability and performance has made it a household name, trusted by millions around the world for both personal and professional needs.

The range of tools offered by Energizer primarily revolves around high-quality battery products designed for diverse applications. From lithium coin batteries to specialty alkaline variants, Energizer’s selection is crafted to meet the demands of various devices, ensuring optimal performance and longevity. Whether it's powering household electronics or ensuring efficiency in professional equipment, Energizer’s batteries are engineered to deliver consistent and reliable energy.

A noteworthy aspect of Energizer as a supplier is its dedication to environmental responsibility. The company actively focuses on developing sustainable products and practices, empowering consumers to make eco-friendly choices without compromising on quality. This commitment not only enhances the lifespan of their products but also reflects a progressive approach towards reducing the environmental impact of battery usage.","Discover the reliable performance of ENERGIZER batteries at Outillage Placide Mathieu. From lithium coin batteries to alkaline and silver oxide options, we have all your power needs covered. Visit Placide.com for more!"
en,EREM,"EREM is a distinguished brand with deep roots in precision tool manufacturing, originating from Switzerland, renowned for its commitment to quality and craftsmanship. The mission of EREM is to develop tools that not only meet but exceed the expectations of professionals and hobbyists alike, ensuring that each product embodies functionality, durability, and ergonomic design. This dedication to excellence reflects the essence of Swiss engineering, positioning EREM as a trusted choice for anyone looking for reliable tools.

The range of tools offered by EREM includes precision tweezers, pliers, and cutters, all meticulously crafted for a variety of applications. Their tools are particularly celebrated in fields requiring delicate work, such as electronics, watchmaking, and fine assembly tasks. EREM’s offerings are designed to provide optimal control and efficiency, catering to both intricate details and broader tasks, ensuring that users can tackle projects with confidence and ease.

A key fact about EREM is their long-standing tradition of innovation, cultivated over several decades. Their commitment to sustainable practices and continuous improvement in tool design has garnered them a loyal following among professionals across various industries. This focus on quality and constant evolution makes EREM a standout supplier in the world of precision tools.",Discover high-quality EREM tools at Outillage Placide Mathieu. Explore our precision tweezers and other exceptional products designed for professionals and DIY enthusiasts alike. Elevate your craftsmanship with EREM tools. Visit Placide.com!
en,Estwing,"Estwing is a renowned American brand with a proud heritage dating back to its founding in 1923. Originating from Rockford, Illinois, the company was birthed with a commitment to crafting high-quality, durable tools for professionals and DIY enthusiasts alike. Their mission centers on precision and reliability, ensuring that each product embodies the ruggedness required to tackle tough jobs while providing a comfortable user experience.

The Estwing product line features an extensive array of hand tools primarily focused on hammers. They offer various types, including straight claw, curved claw, sledgehammers, and specialized options like geological and drywall hammers. Each tool is meticulously designed, with some featuring smooth or milled faces for enhanced performance, making them an essential choice for both construction and renovation projects.

A notable fact about Estwing is their unique manufacturing process, which involves forging each tool from a single piece of steel. This technique not only reinforces durability but also results in tools that maintain their integrity even under the most demanding conditions. As a result, Estwing has earned a reputation for producing tools that withstand the test of time, making them a trusted choice for professionals across various industries.","Discover premium Estwing tools at Outillage Placide Mathieu, including versatile hammers and durable sledgehammers designed for unmatched performance. Elevate your toolkit with our top-quality products. Visit Placide.com for more!"
en,EUROBIT,"EUROBIT originated with a vision to provide high-quality tools that meet the rigorous demands of both professionals and hobbyists. Founded in Europe, the brand emphasizes precision engineering and innovation, striving to enhance productivity and efficiency in various projects. Their mission revolves around empowering users through reliable and durable tools that elevate craftsmanship across multiple industries.

The range of tools offered by EUROBIT includes cutting-edge solutions such as bi-metal hole saws, drill bits, and other essential accessories designed for versatility and performance. Their products cater to a wide array of applications, whether it's construction, woodworking, or metalworking, ensuring that every user can find the right tool for their specific needs. The commitment to quality shines through in their thoughtful designs and the advanced materials they incorporate, setting a standard in the tool industry.

A notable fact about EUROBIT is their focus on sustainability, which reflects their dedication to minimizing environmental impact. By implementing eco-friendly practices in their manufacturing processes and sourcing materials responsibly, EUROBIT not only creates exceptional tools but also contributes positively to the planet. This commitment resonates with consumers who are increasingly seeking environmentally conscious options in their purchasing decisions.","Discover top-quality EUROBIT tools at Outillage Placide Mathieu! Explore our range of durable hole saws, engineered for precision and longevity. Elevate your projects with reliable equipment you can trust. Visit Placide.com for more!"
en,Exact Pipe Tools,"Exact Pipe Tools originated with a clear mission: to deliver innovative and reliable solutions for pipe cutting and beveling in various industrial and construction settings. Founded by professionals who understand the demands of the trade, the brand focuses on enhancing efficiency and precision through advanced technology. Their commitment to quality ensures that every tool meets the high standards required by customers who depend on performance and durability.

The range of tools offered by Exact Pipe Tools is designed to address a wide array of cutting and beveling needs. From electric pipe cutting saws to specialized saw blades, each product is engineered to handle different materials with ease, including PVC, stainless steel, and fiber cement. Their tools are crafted for both versatility and power, allowing users to accomplish their tasks more quickly and with greater accuracy, making them ideal for a variety of applications from plumbing to HVAC.

A noteworthy fact about Exact Pipe Tools is their dedication to continuous improvement and innovation. They invest heavily in research and development, ensuring their products incorporate the latest advancements and user feedback. This commitment not only enhances the effectiveness of their tools but also solidifies their position as a trusted partner for professionals seeking high-quality solutions in the pipe cutting industry.",Discover precision and efficiency with Exact Pipe Tools at Outillage Placide Mathieu. Our range includes electric pipe cutting saws and innovative beveling systems designed for professionals. Elevate your projects today! Visit Placide.com.
en,Featherlite,"Featherlite originated with a vision to create innovative solutions in the realm of hardware and tools, emphasizing quality and reliability since its inception. The brand is driven by an unwavering commitment to serve both professional tradespeople and DIY enthusiasts alike, with a goal of providing tools that enhance efficiency and safety in their day-to-day tasks.

The product range offered by Featherlite is extensive and versatile, catering primarily to those in need of high-performance hydraulic hoses and multi-position ladders. Their selection includes an array of aluminum hydraulic hoses designed for various applications, ensuring durability and strength. Additionally, their multi-position ladders provide remarkable adaptability, allowing users to accomplish tasks with ease and confidence.

One key fact about Featherlite is their dedication to innovation and customer satisfaction, which is evident in the continuous improvement of their products. With a focus on engineering excellence, they prioritize both performance and user experience, making them a dependable choice in the hardware and tools industry.",Discover premium Featherlite hydraulic hoses designed for durability and performance. Our range of lightweight aluminum extension hoses ensures efficient handling and superior quality for your projects. Shop now and visit Placide.com!
en,Fein,"Fein is a renowned brand with deep roots in the German engineering tradition, founded in 1867. Its mission revolves around innovation and quality, embodying a commitment to providing tools that help professionals enhance their craftsmanship and efficiency. Over the years, Fein has established itself as a leader in developing tailored solutions for diverse trades, making it synonymous with reliability and performance.

The brand offers an extensive range of high-performance tools designed for precision and versatility. Among their product lineup are oscillating tools, cutting blades, and drilling lubricants, all thoughtfully engineered to meet the needs of carpenters, electricians, and general contractors alike. Fein’s tools enable users to tackle a wide array of applications with ease, whether it’s making clean cuts or ensuring optimal performance in drilling tasks.

A notable aspect of Fein is its dedication to sustainable practices, emphasizing a balance between durability and environmental responsibility. With over 150 years of expertise, Fein not only prioritizes the performance of its products but also aims to minimize its ecological footprint, making it a trusted choice for both professionals and DIY enthusiasts who value quality and sustainability.","Discover Fein's premium tools at Outillage Placide Mathieu, designed for precision and efficiency. From depth stops to innovative cutting lubricants and oscillating tool blades, we have everything you need for your projects. Visit Placide.com!"
en,Flexovit,"Flexovit originated in Australia and has built a strong reputation in the global market for high-quality abrasives and tools. Established with the mission to provide durable and efficient grinding solutions, the brand emphasizes innovation and performance to meet the evolving needs of both professionals and DIY enthusiasts. Their commitment to excellence ensures that every product is crafted to the highest standards, ultimately enhancing user experience and productivity.

The range of tools offered by Flexovit primarily focuses on sanding discs, available in various sizes and grits. These self-adhesive sanding discs cater to a wide array of applications, making them suitable for woodwork, metalwork, and surface preparation. Designed for superior adhesion and performance, these products ensure a smoother finish and increased efficiency, enabling users to tackle any project with confidence.

A notable fact about Flexovit is its dedication to sustainability and environmentally friendly practices in its manufacturing processes. The company continually invests in research and development to minimize the ecological impact of its products, striving to create a balance between high performance and environmental responsibility. This forward-thinking approach not only reflects their values but also resonates with customers seeking reliable and sustainable tools.","Discover high-quality Flexovit self-adhesive sanding discs at Outillage Placide Mathieu. Perfect for various projects, our discs offer durability and efficiency in sanding. Elevate your tool collection today! Visit Placide.com."
en,Felton Brushes,"Felton Brushes is rooted in a strong tradition of craftsmanship and quality, with a mission to provide reliable and effective cleaning tools for various industries. Established with a commitment to innovation and durability, Felton has become synonymous with excellence, ensuring that customers can depend on their products for both professional and home use.

The brand offers a diverse line of brushes, including manual brushes and brooms designed to meet different cleaning needs. Their selection ranges from versatile scratch brushes made with steel, brass, and stainless steel wire, to larger brooms that are ideal for sweeping tasks. Each product is engineered to deliver optimal performance, making them essential tools in any workshop or cleaning setup.

An important aspect of Felton Brushes is their dedication to sourcing high-quality materials, which ensures the longevity and effectiveness of their tools. This attention to detail not only reflects their commitment to superior craftsmanship but also highlights their reputation among professionals who rely on their products for demanding applications.","Discover Felton Brushes at Outillage Placide Mathieu! Explore a variety of high-quality manual brushes, brooms, and scratch brushes designed for durability and efficiency. Perfect for your cleaning and maintenance needs. Visit Placide.com!"
en,Fluke,"Fluke is a renowned brand that originated in the United States over 70 years ago, with a commitment to providing precision and reliability in electrical measurement. The company's mission revolves around empowering professionals across various industries, ensuring they can perform their tasks with confidence and accuracy. Fluke has built a reputation for innovation and excellence, becoming a trusted name among technicians and engineers worldwide.

Fluke offers a comprehensive range of measurement tools designed for electrical professionals. Their product line includes advanced multimeters, insulation testers, and clamp meters, each engineered to meet rigorous demands. With a focus on functionality and ease of use, these tools are essential for ensuring safety and efficiency in electrical work, making them indispensable for professionals who require accurate readings for maintenance and troubleshooting.

An interesting fact about Fluke is their commitment to sustainability and social responsibility. The company actively seeks to minimize their environmental impact by creating tools that are not only durable and efficient but also designed with the end-user in mind, ensuring long service life and reduced waste. This dedication to quality and eco-friendliness sets Fluke apart in the tool industry, making them a preferred choice for those in need of reliable measuring instruments.",Discover precision and reliability with Fluke tools at Outillage Placide Mathieu. Shop our selection of multimeters and insulation multimeters to assist with all your electrical needs. Visit Placide.com for more information!
en,Flex Tool,"Flex Tool originated in Germany, rooted in a rich tradition of precision engineering and innovative design. Established to meet the demanding needs of professionals, its mission is to empower users with high-quality tools that enhance productivity and performance across various applications. Committed to excellence, Flex Tool has become synonymous with reliability, contributing significantly to the construction and manufacturing sectors.

Their comprehensive range of tools includes everything from powerful rotary grinders and polishing machines to ergonomic hand tools tailored for efficiency and comfort. Each product is crafted with cutting-edge technology, ensuring that users can achieve superior results in both intricate and heavy-duty tasks.

One key fact about Flex Tool is its unwavering dedication to sustainability. The company implements environmentally responsible practices in their manufacturing processes, ensuring that their tools not only perform exceptionally well but also contribute to a greener future. This commitment to sustainability reflects a forward-thinking ethos, positioning Flex Tool as a leader in the tool industry.","Discover the premium quality of Flex Tools at Outillage Placide Mathieu. From innovative bits to powerful tools, enhance your projects with our reliable selection. Shop now and elevate your craftsmanship. Visit Placide.com!"
en,FLEX TOOL,"FLEX TOOL is renowned for its heritage rooted in precision and innovation, with a commitment to enhancing the efficiency of professional tradespeople and DIY enthusiasts alike. Founded in the heart of the tool industry, the brand embodies a mission to deliver cutting-edge solutions that combine durability with ergonomic design. FLEX TOOL strives to support users in their quest for excellence by consistently evolving its product range to meet the demands of modern tasks.

The brand offers a diverse array of tools, ranging from impact driver bits to high-performance circular saw blades. Each product is designed with meticulous attention to detail, ensuring that they cater to various applications, whether in construction, woodworking, or general repairs. The selection available reflects FLEX TOOL's dedication to quality and reliability, making it a go-to choice for those who demand excellence from their tools.

An interesting fact about FLEX TOOL is its continuous investment in research and development. This commitment not only leads to innovative designs but also positions the brand at the forefront of industry advancements, consistently refining their products based on user feedback and emerging technologies. By prioritizing both functionality and user experience, FLEX TOOL reinforces its reputation as a trusted name in the tool market.","Discover the robust range of FLEX TOOL products at Outillage Placide Mathieu. From durable impact driver bits to versatile tools, our selection ensures you have the quality equipment you need. Visit Placide.com for more!"
