langue,marque,description,meta_description
en,Ozat,"Ozat is a brand that originated with a commitment to providing durable and innovative tools for professionals and DIY enthusiasts alike. Established with a vision to enhance productivity and efficiency in various tasks, Ozat continually strives to meet the evolving needs of its customers. Their mission is centered around quality and practicality, ensuring that every tool they produce helps users achieve their project goals with confidence.

The range of tools offered by Ozat includes a variety of high-performance sockets, designed for impact use and crafted to withstand rigorous applications. Their products, such as hex bit impact sockets and deep drive impact sockets, exemplify durability and precision, making them essential for both automotive work and construction. Each tool reflects the advanced engineering behind the Ozat brand, ensuring reliability and effectiveness in a wide array of settings.

A noteworthy aspect of Ozat as a supplier is their commitment to continuous improvement and innovation. By prioritizing research and development, they consistently introduce new technologies and features that cater to the demands of the modern user. This dedication to quality and innovation not only enhances the user experience but also solidifies Ozat's position as a trusted name in the tool industry.",Discover high-quality Ozat tools at Outillage Placide Mathieu. Our range includes durable impact sockets and hex bit sockets designed for efficiency and precision. Equip yourself with the best tools for any project. Visit Placide.com for more!
en,Pearl Abrasive,"Pearl Abrasive, a brand rooted in innovation and quality, has dedicated itself to serving the tool industry since its inception. With a commitment to excellence, Pearl has focused on developing products that enhance the efficiency and safety of users. The brand's mission revolves around providing superior abrasives and accessories that meet the evolving needs of professionals and DIY enthusiasts alike.

The extensive range of tools offered by Pearl Abrasive includes cutting-edge blades, grinding wheels, and various abrasives designed for a multitude of applications. Their products are engineered to provide optimal performance, often tailored for specific materials, ensuring that users can achieve high-quality results. This versatility makes Pearl a reliable choice for both construction and maintenance tasks across diverse industries.

A noteworthy aspect of Pearl Abrasive is their investment in research and development, which enables them to stay at the forefront of technological advancements in manufacturing. This focus on innovation allows them to consistently introduce new products that meet the highest standards, guaranteeing that their customers receive tools that not only perform effectively but also enhance productivity and safety in any project.",Discover top-quality tools from Pearl Abrasive at Outillage Placide Mathieu. Explore our range of grinding wheels and porcelain blades designed for precision and durability. Upgrade your toolkit today! Visit Placide.com.
en,Peakworks,"Peakworks originated with a clear mission: to enhance workplace safety for professionals across various industries. Recognizing the critical need for reliable safety gear, the brand emerged from a commitment to deliver high-performance products that protect workers daily. Their dedication to quality and innovation reflects a strong desire to ensure that every individual can perform their job with confidence and security.

The product range offered by Peakworks includes essential tools designed for safety and efficiency, with a particular emphasis on harnesses and connectors. Their safety harnesses are engineered to meet stringent standards, ensuring durability and comfort for users in various working conditions. Peakworks is known for their commitment to providing tools that not only meet technical specifications but also assist workers in performing their tasks safely and effectively.

A key fact about Peakworks is their focus on continuous improvement and customer feedback. They actively engage with users to refine their product offerings and incorporate the latest safety regulations and technological advancements. This dedication to innovation ensures that their tools remain at the forefront of industry standards, providing peace of mind for those who rely on their equipment.","Discover top-quality Peakworks tools at Outillage Placide Mathieu, including durable temporary connectors and reliable safety harnesses for all your needs. Shop with confidence and enhance your toolkit today. Visit Placide.com."
en,PICA,"PICA is a brand rooted in German craftsmanship, founded with the mission to provide professionals and DIY enthusiasts with innovative marking solutions. With a commitment to quality and functionality, PICA aims to enhance the efficiency and accuracy of every task, ensuring that their tools meet the demands of various work environments. This dedication to excellence is reflected in their continuous research and development, pushing the boundaries of what is possible in the realm of marking tools.

The PICA product range features an impressive variety of high-performance tools, catering to diverse needs in construction, woodworking, and fabrication. Among their offerings are fine and large point markers in vibrant colors, which are designed for precision marking on multiple surfaces. Additionally, PICA’s innovative graphite pencils and refill leads provide versatility and reliability, making them indispensable for tradespeople and creatives alike who require dependable marking solutions.

A noteworthy aspect of PICA is its commitment to sustainability and eco-friendly practices. The brand actively seeks to minimize its environmental impact by using high-quality materials and implementing responsible manufacturing processes. This emphasis on sustainability not only benefits the planet but also empowers customers to make conscientious choices when selecting their tools.","Discover precision and versatility with PICA markers, perfect for any project. From fine to large point tips, these markers deliver vibrant color and reliability for all your marking needs. Visit Placide.com for more!"
en,Picquic,"Picquic is a brand rooted in innovation and craftsmanship, originally founded in Canada. The company was established with the mission to provide high-quality tools that enhance the efficiency and experience of both professionals and DIY enthusiasts. With a focus on durability and functionality, Picquic aims to simplify tools’ use, making them accessible to everyone, while maintaining a strong commitment to manufacturing excellence.

The range of tools offered by Picquic includes a variety of screwdrivers and multi-bit tools designed to meet diverse demands. Their products are engineered for precision, featuring ergonomic designs that ensure comfort during prolonged use. Whether you're tackling a small home project or professional assembly tasks, Picquic's screwdrivers provide versatile and reliable solutions tailored for various applications.

A noteworthy aspect of Picquic is its dedication to sustainability, as the brand prioritizes environmentally responsible practices in its production processes. By using recyclable materials and reducing waste during manufacturing, Picquic not only delivers exceptional tools but also contributes to a greener planet, making their offerings not just functional but also environmentally conscious.","Discover the versatility of Picquic tools at Outillage Placide Mathieu! Explore our range of high-quality screwdrivers, including Phillips, mixed, and multi-bit options. Perfect for any project, professional or DIY. Visit Placide.com for more!"
en,Pioneer,"Pioneer originated with a vision to provide quality tools and safety equipment for professionals and DIY enthusiasts alike. Founded on the belief that every worker deserves reliable gear, the brand has committed itself to manufacturing durable products that enhance safety and performance. Their mission is to empower individuals by delivering tools that not only meet industry standards but also ensure comfort and efficiency on every job site.

The range of tools available under the Pioneer brand is extensive, catering to various sectors from construction to surveying. Notable products include high-visibility surveyor's vests in multiple sizes, designed for optimal safety and practicality. These vests feature durable materials and thoughtful designs, ensuring that wearers are protected in dynamic work environments while remaining comfortable throughout the day.

A key fact about Pioneer is their dedication to sustainability in manufacturing. The supplier continually seeks innovative methods to reduce environmental impact, inspiring other brands in the industry to prioritize eco-friendly practices. This commitment not only makes their products trustworthy but also aligns with the growing demand for responsible production in today’s market.","Discover high-visibility Pioneer surveyor's vests in various sizes for ultimate safety on the job site. Durable and designed for comfort, these vests ensure you're seen and protected. Visit Placide.com for our full range of Pioneer products!"
en,Pioneer/Ranpro,"Pioneer/Ranpro is a respected brand rooted in a commitment to quality and safety within the hardware and tools industry. Founded with a vision to empower workers and DIY enthusiasts, their mission revolves around providing reliable and durable products that meet the highest safety standards. The brand aims to enhance the work experience, ensuring that professionals and hobbyists alike can perform their tasks effectively and confidently.

The product range from Pioneer/Ranpro encompasses a variety of essential tools designed for both industrial and personal use. Their offerings include robust safety apparel, such as a diverse selection of navy blue safety shirts available in multiple sizes, ensuring that every worker is equipped for visibility and comfort on the job. Each item is crafted to meet rigorous standards, focusing on functionality while maintaining a professional appearance.

A key aspect of Pioneer/Ranpro is their dedication to sustainability and innovation. The supplier adheres to environmentally friendly practices in their manufacturing processes, ensuring that their tools not only serve practical purposes but also contribute positively to the environment. This commitment to responsible production is a testament to their leadership in the hardware industry.","Discover top-quality Pioneer/Ranpro safety shirts in versatile navy blue, designed for comfort and durability at work. Perfect for any professional seeking reliable gear. Shop now and elevate your safety wear! Visit Placide.com."
en,Ranpro,"Ranpro originated with a commitment to enhancing safety and performance in demanding work environments. Founded on principles of quality and reliability, the brand aims to provide essential tools and apparel for professionals who require durable solutions. Their mission is to equip workers with reliable gear that withstands the rigors of various industries, ensuring both comfort and protection.

The range of products offered by Ranpro includes a diverse selection of high-performance tools and protective clothing. Notably, their flame-resistant shirts and waterproof coveralls stand out for their ability to provide safety without compromising on functionality. These items are designed for those who face challenging work conditions, delivering durability and comfort essential for long hours on the job.

A key aspect of Ranpro's operations is their dedication to continual improvement and innovation within the industry. By conducting extensive research and collaborating with field professionals, the brand strives to develop products that meet or exceed safety standards. This focus ensures that every piece of clothing and tool reflects a commitment to quality and reliability, helping workers perform their best.","Discover the Ranpro collection at Outillage Placide Mathieu, featuring premium flame-resistant shirts in various sizes. Ensure safety and comfort in your work environment with our durable and reliable apparel. Visit Placide.com for more!"
en,PIONEER,"PIONEER originated with a commitment to providing high-quality tools and equipment that cater to both professionals and DIY enthusiasts. Established in the heart of the industrial sector, the brand's mission revolves around bridging the gap between functionality and innovation. They strive to empower users with products that enhance their productivity while ensuring safety and longevity.

The PIONEER lineup encompasses a diverse range of tools, including power tools, hand tools, and accessories designed for various applications. From cutting-edge drills to reliable hand tools, each product reflects the brand’s dedication to durability and performance, ensuring that every technician or hobbyist finds the right solution for their projects. Their offerings extend beyond traditional tools, incorporating specialized items such as insulated clothing to ensure comfort during long hours of work.

A key fact about PIONEER is its unwavering focus on sustainability. The supplier is committed to eco-friendly manufacturing practices, prioritizing materials and processes that minimize environmental impact. This dedication not only reflects the brand's responsibility to the planet but also ensures that customers can feel good about their purchases, knowing they support a company that values sustainability alongside quality.","Discover the comfort and warmth of PIONEER's quilted hooded polar fleece shirts at Outillage Placide Mathieu. Perfect for outdoor adventures or cozy days at home, our selection combines style and functionality. Visit Placide.com for more!"
en,Primeline Tools,"Primeline Tools has its roots in a firm commitment to providing high-quality hand tools that cater to both professionals and DIY enthusiasts. Established with a mission to enhance craftsmanship and ensure precision in every project, the brand stands out for its dedication to innovation and reliability. Their team continually strives to create products that not only meet industry standards but also resonate with the practical needs of users.

The product range from Primeline Tools is expansive, specializing in hand seamers that are essential for various applications in metalworking, HVAC, and construction. Each hand seamer is crafted with attention to detail, ensuring optimal performance and durability. Whether you’re working on intricate tasks or larger projects, Primeline Tools provides tools that enhance productivity and ease of use.

A notable aspect of Primeline Tools is their commitment to sustainability, employing environmentally friendly practices throughout their manufacturing processes. This not only ensures the longevity of their products but also reflects their dedication to minimizing their ecological footprint, making them a responsible choice for both consumers and professionals in the industry.","Discover high-quality Primeline Tools at Outillage Placide Mathieu. Explore our range of durable hand seamers, designed for precision and ease. Elevate your projects with reliable tools you can trust. Visit Placide.com for more!"
en,PRIMELINE TOOLS,"PRIMELINE TOOLS originated with a vision to support both professionals and DIY enthusiasts by providing high-quality, reliable tools that enhance productivity and craftsmanship. With a commitment to innovation, PRIMELINE focuses on creating solutions that simplify tasks and improve efficiency in various applications. Their mission is to empower users by offering tools that not only meet but exceed expectations in performance and durability.

The brand features a diverse range of tools designed to cater to different needs, from heavy-duty shank bit holders to precision tools perfect for intricate projects. PRIMELINE TOOLS is known for its sturdy and user-friendly designs that prioritize safety and effectiveness. The products are engineered for various applications, whether in construction, woodworking, or general maintenance, ensuring users have the right tools at their disposal.

A notable aspect of PRIMELINE TOOLS is their commitment to continuous improvement and sustainability. They actively seek to incorporate eco-friendly practices into their manufacturing processes, reducing environmental impact without sacrificing the quality or reliability that customers expect. This dedication to responsible production not only benefits users but also reflects their values as a forward-thinking brand in the tools industry.",Discover the exceptional quality of PRIMELINE TOOLS at Outillage Placide Mathieu. Explore our diverse range of innovative tools designed for efficiency and durability. Elevate your projects with precision. Visit Placide.com for more!
en,Proto/Facom,"Proto/Facom has a rich heritage that dates back to its inception in the early 20th century, founded with a commitment to delivering precision-engineered tools. The brand's mission is to provide high-quality solutions to professionals and enthusiasts alike, ensuring every tool meets rigorous standards of reliability and performance. This dedication to craftsmanship reflects a deep understanding of the demands faced by those who rely on their tools for their trade.

The range of tools offered by Proto/Facom is diverse, catering to various needs across multiple industries. From sturdy clamping solutions to specialized gage blocks, their lineup includes tools designed for precision measurement, automotive repair, and construction applications. Each product is thoughtfully engineered to enhance efficiency and accuracy, making them essential companions for any serious toolkit.

A significant aspect of Proto/Facom is their continuous focus on innovation and quality control. As part of Stanley Black & Decker, they benefit from extensive research and development resources, allowing them to stay at the forefront of the tool industry. This ensures that every product not only meets the expectations of today’s professionals but often exceeds them, contributing to a legacy of excellence that has made Proto/Facom a trusted name worldwide.","Discover high-quality Proto/Facom tools at Outillage Placide Mathieu. Explore our selection of reliable C-clamps and precision steel gauge blocks, designed for durability and accuracy in every project. Elevate your tool collection today! Visit Placide.com."
en,Quik Drive,"Quik Drive originated with a commitment to revolutionizing the way fasteners are used in construction and woodworking projects. Founded in the late '90s, the brand was established to address the inefficiencies and frustrations that contractors and builders faced while working with traditional fastening methods. Quik Drive's mission is to enhance productivity and precision, empowering professionals with innovative tools that streamline their work while ensuring quality results.

The brand offers an extensive range of tools designed for various applications, including collated screws and auto-feed screwdrivers. Their products, such as the Cordless PROCCS+ Multi-Purpose Combo System, exemplify versatility and efficiency, catering to both drywall installation and general carpentry tasks. Quik Drive's collated screws are thoughtfully designed for compatibility with their auto-feed systems, making them ideal for any project requiring speed and accuracy.

A defining aspect of Quik Drive is their focus on continuous innovation and quality control. The company collaborates closely with users to refine their tools based on real-world feedback, ensuring that each new product addresses specific needs in the field. This commitment to user-driven design has positioned Quik Drive as a leader in the fastening industry, trusted by professionals for their reliability and performance.",Discover the innovative Quik Drive range at Outillage Placide Mathieu! Explore top-quality collated screws and versatile auto-feed screwdrivers designed for efficiency and precision. Enhance your projects today. Visit Placide.com!
en,Rayovac,"Rayovac was founded in the early 1900s with a commitment to producing durable, reliable batteries and electric bulbs. Originating from a passion for innovation in power solutions, the brand has always focused on delivering high-quality products that prioritize performance and longevity. Their mission revolves around providing consumers with dependable energy sources to keep everyday life running smoothly.

The range of tools offered by Rayovac includes a variety of electric bulbs designed for optimal brightness and energy efficiency. Their products cater to both residential and commercial needs, ensuring that customers have access to reliable lighting solutions. Each bulb is engineered to provide consistent performance, making them a favored choice for those seeking quality and reliability in their lighting fixtures.

An interesting fact about Rayovac is that they have consistently been a pioneer in the battery industry, being one of the first brands to introduce rechargeable batteries to the market. Their dedication to sustainability and innovation reflects a deep understanding of consumer needs, ensuring that their products not only meet but exceed expectations in today’s fast-paced world.","Discover the trusted Rayovac brand at Outillage Placide Mathieu, featuring high-performance electric bulbs for all your lighting needs. Illuminate your space with quality and reliability. Visit Placide.com for more!"
en,Record,"Record is a respected brand with a rich heritage, originating in the United Kingdom over a century ago. It was founded on the principles of craftsmanship and innovation, with a mission to provide tradespeople and DIYers alike with high-quality tools that enhance their productivity and precision. Record has continuously focused on quality and reliability, making its name synonymous with robust engineering and trustworthy performance in the world of hand tools.

The brand offers a diverse array of tools that cater to a variety of trades and projects. Among their standout products are their range of mechanic's vises, available in different sizes to suit various applications. From general purpose clamping to heavy-duty tasks, Record vises are designed with precision and durability in mind, allowing users to tackle projects with confidence. Each tool reflects the brand's commitment to excellence, ensuring that they meet the demands of both professional craftsmen and enthusiastic hobbyists.

One remarkable fact about Record is their steadfast dedication to manufacturing in the UK. This commitment not only supports local craftsmanship but also ensures that their products maintain the highest standards of quality control. By keeping production in-house, Record takes pride in every tool they create, providing customers with a guarantee of performance and longevity that is hard to match in today’s market.","Discover high-quality Record mechanic's vises at Outillage Placide Mathieu. Perfect for any workshop, these durable tools provide precision and ease for all your clamping needs. Visit Placide.com for our full selection and unbeatable prices!"
en,Reed,"Reed is a brand with a rich history, founded in the early 20th century with a mission to provide high-quality tools that meet the demands of professionals and DIY enthusiasts alike. Originating from a commitment to craftsmanship and innovation, Reed has focused on creating reliable tools that stand the test of time. Their dedication to excellence continues to guide their design and manufacturing processes, ensuring that every tool reflects a legacy of precision and durability.

The range of tools offered by Reed is vast and includes specialized wrenches, pipe tools, and tube cutters, among other essential equipment. Each product is engineered to enhance performance and efficiency, making them invaluable for both skilled tradespeople and home repair tasks. The innovative designs prioritize usability, allowing users to work smarter and achieve superior results, whether in a professional setting or a personal project.

A key aspect of Reed as a supplier is its commitment to American manufacturing. By producing a significant portion of its tools domestically, Reed not only supports local economies but also maintains stringent quality control standards. This dedication to American craftsmanship ensures that customers receive tools that are functional, reliable, and built to last, staying true to the brand's core values.","Discover Reed's innovative tools, including Thru-Bolt™ 4-in-1 Ratchet Wrenches designed for efficiency and versatility. Elevate your toolkit with trusted quality and performance. Explore more at Placide.com!"
