langue,marque,description,meta_description
en,Marples,"Marples is a distinguished brand originating in the heart of the UK, with a rich heritage that dates back to the 19th century. Known for its commitment to quality craftsmanship, Marples aims to provide woodworkers and DIY enthusiasts with tools that stand the test of time. Their mission revolves around delivering reliable and innovative tools that enhance the art of woodworking, making it accessible and enjoyable for all.

The product range from Marples primarily consists of high-quality chisels, designed to meet the diverse needs of woodworkers. From the finely crafted 1/4"" to the robust 2"" wood chisels, each tool showcases superior materials and ergonomic designs. Marples offers various sets that cater to both novice and seasoned craftsmen, ensuring that every woodworking project can be approached with confidence and precision.

An interesting aspect of Marples is its longstanding legacy, built on a foundation of skilled craftsmanship that continues to influence modern tool design. The brand has evolved over the years while retaining its core values, making it a trusted name among woodworkers globally. This commitment to excellence and innovation is what sets Marples apart, ensuring its tools remain an essential part of every woodworker’s toolkit.",Discover premium Marples chisels at Outillage Placide Mathieu. Our selection features craftsmanship-focused tools perfect for woodworkers. Elevate your projects with our reliable and efficient chisels. Visit Placide.com now!
en,Speedbor,"Speedbor is a renowned brand with a rich history in the tool manufacturing industry, dedicated to providing high-quality drilling solutions. Founded with the mission of enhancing woodworking precision and efficiency, Speedbor has continuously evolved, embracing innovative technologies and methodologies to meet the needs of both professionals and DIY enthusiasts. Their commitment to excellence and craftsmanship ensures that each tool embodies durability and performance.

The brand offers an extensive range of tools specifically designed for fast, clean drilling into wood. Among their most notable products are the brad-point drill bits, which are engineered to deliver superior accuracy and clean entry points, reducing splintering for a flawless finish. Speedbor also provides an array of accessories aimed at improving the overall woodworking experience, catering to various applications and skill levels.

A noteworthy aspect of Speedbor is their emphasis on quality control and testing throughout the manufacturing process. Each tool undergoes rigorous evaluation to ensure it meets the high standards that professionals have come to expect. This dedication to quality has solidified Speedbor’s reputation as a trusted name in the industry, making them a go-to brand for reliable and efficient drilling solutions.","Discover the superior precision of Speedbor drilling tools at Outillage Placide Mathieu. Explore our premium brad-point wood drill sets, designed for effortless woodwork and superior performance. Visit Placide.com for more!"
en,Itm,"Itm, a renowned name in the tools industry, has its roots in a commitment to high-quality manufacturing and innovation. Founded with the mission of providing professional-grade solutions for both professionals and DIY enthusiasts, the brand has consistently focused on precision and durability. Itm’s dedication to excellence is reflected in its continuous efforts to adapt to the evolving needs of the market while maintaining the highest standards of craftsmanship.

The product range offered by Itm is extensive, featuring an impressive collection of metal drill bits in various sizes and specifications. Each drill bit is crafted from high-speed steel, ensuring not only effective performance but also longevity under rigorous use. This array of extra-long drill bits is designed to meet the demands of diverse applications, enabling users to accomplish their projects with greater efficiency and precision.

A key fact about Itm is its strong emphasis on quality control throughout the manufacturing process. Each product undergoes rigorous testing to ensure it meets the highest durability and performance standards. This commitment to quality has positioned Itm as a trustworthy supplier in the hardware and tools market, making it a preferred choice for those seeking reliable tools for their tasks.","Discover high-quality HSS extra-long metal drill bits from Itm at Outillage Placide Mathieu. Perfect for precise drilling in various materials, our selection is designed for durability and performance. Visit Placide.com for more information!"
en,Jacobs Chuck,"Jacobs Chuck has a rich heritage rooted in innovation and quality in the tool industry. Founded in the early 20th century, the brand has consistently focused on delivering exceptional tools that meet the demanding needs of professionals and enthusiasts alike. Its mission focuses on providing dependable and precision-engineered products that enhance performance while ensuring safety and ease of use for users around the globe.

The brand specializes primarily in manufacturing high-quality chuck keys designed to fit various drill chucks. These tools are essential for securing bits and enable users to work efficiently across a wide array of applications, from woodworking to metalworking. Jacobs Chucks are known for their durability and precision, allowing for smooth operation and reliable performance, which is crucial in achieving accurate results.

A notable fact about Jacobs Chuck is its commitment to innovation, as the company continues to invest in research and development to enhance its product offerings. This focus on continuous improvement ensures that each chuck key not only meets the industry's current standards but often sets new ones, reinforcing its reputation as a trusted choice among professionals.","Discover high-quality Jacobs Chuck products at Outillage Placide Mathieu. From reliable chuck keys to versatile accessories, find everything you need for your projects. Explore our selection now! Visit Placide.com."
en,JACKFIELD,"JACKFIELD originated with a strong commitment to providing quality and durable workwear, inspired by the needs of professionals in demanding environments. The brand’s mission centers on delivering practical solutions that combine functionality and comfort, ensuring that workers can perform their tasks efficiently while remaining protected. By focusing on reliability and innovative design, JACKFIELD aims to support those who rely on their gear for daily labor.

The brand offers an extensive range of tools and clothing designed for various work conditions. Their line includes a variety of work pants, focusing on durability and waterproof features, allowing workers to stay dry and comfortable in any situation. Each product is thoughtfully designed to meet the challenges faced in diverse industries, from construction to marine applications, showcasing the brand's dedication to practical and resilient workwear.

A noteworthy fact about JACKFIELD is their commitment to sustainability. The supplier emphasizes eco-friendly practices in their production processes, ensuring that the materials used are not only high-quality but also responsibly sourced. This thoughtful approach allows JACKFIELD to contribute positively to both the work environment and the planet, aligning with the values of a modern workforce that seeks to minimize their ecological footprint.","Discover high-quality JACKFIELD work pants designed for durability and comfort, perfect for any job. Explore our selection in various styles and sizes to meet all your workwear needs. Visit Placide.com for more!"
en,ITC,"ITC, a renowned name in the tool and hardware industry, originated with a mission to provide reliable and innovative solutions for both professionals and DIY enthusiasts. Founded on principles of quality and durability, ITC aims to empower users by offering products designed to enhance productivity and safety in their projects. Their commitment to excellence is reflected in every tool they produce, ensuring customers can tackle any task confidently.

The brand offers an extensive range of tools tailored to meet diverse needs. From portable air tanks ideal for inflation and air compression tasks to a variety of other specialized tools, ITC focuses on performance and functionality. Their products are engineered with a keen eye on usability, making them suitable for various applications, whether in workshops, job sites, or home projects.

ITC stands out not only for its exceptional product quality but also for its dedication to sustainability. The company actively seeks to minimize its environmental impact through responsible sourcing and manufacturing processes. This commitment to eco-friendly practices complements their mission to provide innovative tools, ensuring that customers can feel good about their purchases while enjoying the benefits of high-quality equipment.","Discover high-quality ITC products at Outillage Placide Mathieu, including versatile portable air tanks suited for all your needs. Elevate your projects with reliable tools designed for efficiency and durability. Visit Placide.com."
en,Jet,"Jet Tools, established in the late 1950s, has a rich history rooted in quality and innovation. Originally founded to provide high-performance machinery, Jet has steadily expanded its mission to equip professionals and DIY enthusiasts with reliable tools that enhance productivity and craftsmanship. Their commitment to excellence is reflected in their continuous pursuit of advanced technology and user-friendly designs.

The Jet product line encompasses a diverse range of hand tools and equipment, including electrician pliers, long nose pliers, cutting pliers, and various sizes of mechanic’s vises. Each tool is meticulously engineered for durability and efficiency, ensuring that users can tackle their projects with confidence. Whether for industrial applications or home improvement tasks, Jet tools are known for their robust performance and ergonomic design.

Jet Tools takes pride in its dedication to customer satisfaction, which is evident in their extensive warranty and support services. With a focus on innovation and quality, Jet has established itself as a trusted name among professionals in numerous fields, continually adapting to meet the evolving needs of its users.","Discover high-quality Jet tools at Outillage Placide Mathieu. Our selection includes precision electrician pliers, versatile long nose and cutting pliers, robust tongue & groove pliers, and durable mechanic's vises. Elevate your toolkit today! Visit Placide.com."
en,Strongarm,"Strongarm originated from a commitment to provide reliable and high-quality tools for both professionals and hobbyists alike. With roots in the heart of industrial innovation, the brand’s mission is to empower users with tools that enhance performance and ensure safety in every task. Strongarm emphasizes durability and user-friendly designs, reflecting its dedication to making hard work easier and more efficient.

The range of tools offered by Strongarm is extensive, encompassing various lifting solutions and hydraulic equipment. Their product lineup includes a variety of robust bottle jacks that come in several capacities to accommodate different lifting needs. Additionally, Strongarm provides essential hydraulic hoses, shop cranes, and engine tilters, all crafted to meet the rigorous demands of both the automotive and industrial sectors, ensuring reliability on any job site.

A key fact about Strongarm is its commitment to innovation and quality assurance, which is showcased through rigorous testing of all products to meet industry standards. This attention to detail not only underscores the brand’s reliability but also solidifies its reputation among users who seek dependable solutions for their lifting and automotive needs.","Discover the reliable Strongarm bottle jacks, designed to lift heavy loads with ease and safety. Perfect for any job, these durable tools are essential for your workshop. Explore our full selection at Outillage Placide Mathieu. Visit Placide.com!"
en,Startech,"Startech, a brand rooted in innovation and quality, was founded to meet the growing demands of both professionals and DIY enthusiasts in the hardware industry. With a mission centered around delivering reliable and efficient tools, Startech strives to empower users by providing them with products that simplify their tasks and enhance their productivity.

The range of tools offered by Startech includes a variety of essential equipment designed for versatility and performance. From practical LED flashlights and headlights to heavy-duty extension cords of different lengths, Startech's products are engineered to meet the needs of any job site or home project. These tools emphasize durability, ensuring they stand up to the rigors of regular use while providing optimal functionality.

An impressive aspect of Startech is its commitment to sustainability and safety, reflecting a deep awareness of the environment and worker well-being. The brand not only focuses on high-quality manufacturing but also integrates eco-friendly practices into its production processes, underscoring its role as a responsible supplier in the hardware industry.","Discover the innovative Startech products at Outillage Placide Mathieu! From powerful LED flashlights and headlights to versatile work lights and extension cords, equip yourself with tools that shine in quality and performance. Visit Placide.com for more!"
en,Johnson,"Johnson is a brand with a rich heritage, established to provide reliable and precise measuring solutions for both professionals and DIY enthusiasts. Rooted in a commitment to quality, Johnson's mission has always been to simplify complex tasks with innovative tools that stand the test of time. With a focus on accuracy and durability, the brand strives to enhance productivity in various construction and renovation projects.

The range of tools offered by Johnson includes essential measuring and leveling instruments that are vital for ensuring precision in any project. From surface levels to laser distance measurers, each product is engineered with user-friendly features that make them not only effective but also accessible for those at any skill level. Johnson tools are designed to meet the needs of contractors, carpenters, and hobbyists alike, making them indispensable in the toolkit of anyone working with their hands.

A key fact about Johnson is that the brand places strong emphasis on sustainability in its manufacturing processes, ensuring that their products not only meet high-performance standards but also adhere to environmentally responsible practices. This commitment to eco-friendly production reflects Johnson's awareness of its role in contributing positively to the environment while serving the needs of its customers.",Discover top-quality Johnson tools at Outillage Placide Mathieu! Explore our range including precision surface levels designed for accuracy and durability. Elevate your projects with trusted craftsmanship. Visit Placide.com to shop now!
en,Jepson,"Jepson is a brand rooted in a dedication to quality and innovation, originating from a desire to empower both professional contractors and DIY enthusiasts. With a mission to deliver reliable tools that enhance efficiency and precision, Jepson has positioned itself as a trusted name in the hardware industry. Their commitment to craftsmanship and user-focused design is evident in every product they create, aiming to elevate the standards of tools available to users worldwide.

The brand offers a diverse array of power tools designed to meet the demands of various projects. Whether you’re looking for a portable cut-off saw or a highly accurate miter saw, Jepson provides tools that are engineered for performance and durability. Their range also includes circular saws, catering to both smaller and larger applications, ensuring that users can find the right tool for any job, from intricate cuts to heavy-duty tasks.

A notable aspect of Jepson is its commitment to sustainability within manufacturing processes. The supplier actively seeks to minimize environmental impact and prioritize eco-friendly practices, reflecting a growing awareness in the industry. This dedication not only supports a healthier planet but also resonates with consumers who value responsible sourcing and environmentally friendly products.","Discover the exceptional quality and performance of Jepson tools at Outillage Placide Mathieu. From portable cut-off saws to precision miter saws, our collection meets all your cutting needs. Elevate your projects today! Visit Placide.com."
en,Kar,"Kar is a renowned brand that has its roots firmly planted in a commitment to quality and innovation. Established with the mission to provide reliable tools for both professionals and DIY enthusiasts, Kar aims to make every project easier and more efficient. The brand prioritizes craftsmanship and continuously seeks to improve its offerings, ensuring that each product meets the high standards expected by its users.

The variety of tools offered by Kar is extensive, covering numerous categories to cater to diverse needs. From precision engineering tools to robust cutting solutions like bi-metal hole saws, the brand is dedicated to providing tools that enhance performance and durability. Each product is designed with user efficiency in mind, allowing for seamless incorporation into any toolkit and project.

An interesting fact about Kar is its focus on sustainability. The brand actively incorporates environmentally friendly practices in its manufacturing processes, which not only reduces waste but also aligns with modern consumer values. This commitment to sustainability makes Kar a responsible choice for those looking to invest in high-quality tools while also being mindful of their environmental impact.",Discover high-quality Kar tools at Outillage Placide Mathieu. Explore our selection of durable bi-metal hole saws and enhance your drilling experience. Quality and performance you can trust. Visit Placide.com for more!
en,Shaviv,"Shaviv originated from Israel and has built a strong reputation for its dedication to manufacturing high-quality deburring tools and accessories. The brand's mission revolves around enhancing productivity and precision in metalworking tasks, focusing on innovation and user satisfaction. Shaviv combines cutting-edge technology with the expertise of skilled professionals to create tools that cater to the diverse needs of craftsmen and industries alike.

Their product range primarily includes various deburring tools that effectively remove sharp edges and burrs from machined parts, promoting safety and improving the finish of components. The tools are designed for easy handling, making them suitable for both light and heavy-duty applications. Shaviv’s focus on ergonomic design ensures that users can operate their tools comfortably for extended periods, enhancing both efficiency and quality.

An interesting fact about Shaviv is its commitment to sustainability and environmental responsibility. The brand continually strives to minimize waste and energy consumption in its manufacturing processes. This dedication not only reflects the company’s values but also appeals to a growing segment of environmentally conscious users within the industry. Through meticulous engineering, Shaviv remains a trusted choice for those seeking reliability and performance in their tools.","Discover top-quality Shaviv deburring tools at Outillage Placide Mathieu! Offering precision for every project, our range includes versatile blades for flawless finishes. Elevate your craftsmanship today. Visit Placide.com for more!"
en,GearWrench,"GearWrench originated with a clear mission: to provide innovative tools that enhance the efficiency and productivity of professionals in various trades. Established with a commitment to quality and performance, the brand has consistently focused on addressing the real-world needs of mechanics and technicians. Their dedication to craftsmanship and ergonomic design places GearWrench as a stalwart in the hand tools industry, aiming to make every task easier and more efficient for its users.

The range of tools offered by GearWrench is extensive, encompassing a variety of sockets, extensions, adapters, and other essential hand tools designed for mechanics and DIY enthusiasts alike. Their products are engineered for durability and reliability, with unique features like their Vortex socket design, which provides superior grip and reduces wear. This attention to detail ensures that each tool not only meets high standards of performance but also enhances user experience in demanding environments.

A noteworthy aspect of GearWrench is its commitment to innovation, exemplified by its extensive investment in research and development. This dedication allows GearWrench to stay at the forefront of tool technology, constantly introducing new products that reflect the changing demands of the marketplace. Whether you’re a professional mechanic or a home improvement aficionado, GearWrench remains dedicated to enhancing your toolbox through reliable, cutting-edge solutions.","Explore high-quality GearWrench products at Outillage Placide Mathieu, including durable Vortex sockets designed for precision and efficiency. Equip your toolbox with reliable tools that make every job easier. Visit Placide.com."
en,GEARWRENCH,"GEARWRENCH originated with a clear mission to innovate and improve the struggle of everyday mechanics and DIY enthusiasts. Founded to provide superior quality and cutting-edge design in hand tools, GEARWRENCH has evolved into a brand trusted by professionals and hobbyists alike. Their commitment to delivering exceptional performance and durability remains at the forefront of their operations, continually enhancing the productivity of users across various industries.

The brand's extensive range of tools includes everything from wrenches and sockets to specialized automotive tools, designed to tackle a wide array of tasks. Each tool is engineered with precision to ensure efficiency, ease of use, and reliability. With features that address the specific needs of technicians, GEARWRENCH consistently aims to offer innovative solutions that make repairs and projects smoother.

GEARWRENCH is known as a pioneer in the wrench category, being one of the first brands to offer a ratcheting wrench design that allows for quicker and more efficient fastening. Their innovative spirit is matched by strict quality control processes, ensuring that each tool meets the highest standards before it reaches the market. This combination of tradition and innovation has solidified GEARWRENCH's reputation as a leading provider of reliable tools for professionals around the globe.","Discover the innovative GEARWRENCH tools at Outillage Placide Mathieu! Enhance your workshop with top-quality products like the versatile filter wrench, designed for ultimate performance and durability. Visit Placide.com to explore our full range!"
en,Keto/Hitech,"Keto/Hitech originated as a response to the growing demand for reliable and high-quality tools in the hardware industry. Founded with the mission to empower both professionals and DIY enthusiasts, the brand focuses on innovation, durability, and exceptional performance. Their commitment to excellence has established them as a trusted name among tool users, ensuring that every product made meets stringent quality standards.

The product range from Keto/Hitech includes a variety of mounted wheels designed for precision and versatility. These tools are meticulously crafted to cater to various applications, from grinding to polishing. Each mounted point is designed with the user in mind, offering superior reliability and a consistent finish that professionals rely on. This makes their tools suitable for a wide range of projects, ensuring optimal results every time.

A notable fact about Keto/Hitech is their dedication to sustainability and responsible sourcing. The supplier is committed to minimizing environmental impact by utilizing eco-friendly materials and practices in their production processes. This forward-thinking approach not only enhances the quality of their tools but also reflects their commitment to fostering a sustainable future within the hardware industry.","Explore the premium quality and versatility of Keto/Hitech tools at Outillage Placide Mathieu. Our range includes mounted wheels designed for precision and durability, perfect for various projects. Visit Placide.com for more details!"
