langue,marque,description,meta_description
fr,Airmax,"Airmax est une marque reconnue pour son expertise dans le domaine des outils pneumatiques et hydrauliques. Fondée avec l’ambition de fournir des solutions performantes et fiables, Airmax s'engage à offrir des produits de qualité qui répondent aux exigences des professionnels et des passionnés du bricolage. Leur mission est de simplifier les travaux complexes grâce à des outils robustes et innovants.

La gamme d'outillage proposée par Airmax est variée et comprend des robinetteries, des purgeurs et des soupapes de sécurité, tous conçus pour garantir un fonctionnement optimal des systèmes pneumatiques et hydrauliques. Que ce soit un robinet quart de tour de différentes tailles ou des tubes pneumatiques, chaque produit est soigneusement fabriqué pour assurer une performance durable et une sécurité accrue.

Un fait marquant sur Airmax est leur engagement envers l'innovation continue. La marque investit régulièrement dans la recherche et le développement, ce qui lui permet d'introduire des technologies avancées et d'améliorer constamment ses produits. Cette approche proactive garantit aux utilisateurs que chaque outil Airmax est non seulement moderne, mais également à la pointe de la technologie.","Découvrez notre sélection de produits Airmax, incluant des robinets quart de tour et des purges de haute qualité, parfaits pour vos projets. Fiabilité et performance au rendez-vous ! Visitez Placide.com."
fr,Ajax,"Ajax est une marque d'outillage reconnue pour son engagement envers la qualité et l'innovation. Fondée il y a plusieurs décennies, elle a toujours eu pour mission de fournir des outils performants qui répondent aux besoins des professionnels comme des bricoleurs. Sa réputation repose sur le sérieux et la fiabilité de ses produits, permettant à chacun de réaliser ses projets avec précision et efficacité.

Le catalogue d'Ajax comprend une large gamme d'outils, allant des mandrins de haute performance aux ciseaux robustes, en passant par des burins et autres accessoires indispensables. Chaque produit est conçu pour offrir durabilité et performance, garantissant ainsi que les utilisateurs disposent de l'outillage nécessaire pour mener à bien leurs tâches. Avec un souci du détail, la marque s'assure que chaque outil soit à la hauteur des attentes de ses utilisateurs, quel que soit leur niveau d'expertise.

Un fait intéressant sur Ajax est qu'elle collabore étroitement avec des experts du secteur pour développer ses produits. Cela permet à la marque de rester à l'avant-garde des tendances et des technologies en matière d'outillage. Cette approche axée sur l'innovation contribue à l'élargissement constant de leur gamme, faisant d'Ajax un choix de confiance pour tous ceux qui cherchent des outils de qualité.","Découvrez notre gamme d'outils Ajax chez Outillage Placide Mathieu. Profitez de mandrins et ciseaux de haute qualité, idéaux pour tous vos projets. Explorez des équipements fiables pour les professionnels et les amateurs. Visitez Placide.com."
fr,Alemite,"Alemite, fondée au début du XXe siècle, est une marque reconnue dans le domaine de l'outillage, réputée pour sa mission de fournir des solutions innovantes et efficaces pour la lubrification et l'entretien des machines. L'entreprise s'est toujours efforcée d'allier technologie de pointe et durabilité, en mettant au cœur de ses préoccupations la satisfaction de ses clients et l'optimisation de leurs processus de maintenance.

Leurs produits comprennent une large gamme d'outils et d'accessoires, comme des raccords hydrauliques, des soupapes de sécurité, des collier de serrage et des coupleurs. Chaque élément est conçu pour répondre aux besoins spécifiques des professionnels, que ce soit dans l'industrie automobile, la mécanique générale ou d'autres secteurs nécessitant un entretien régulier des équipements.

Alemite se distingue non seulement par la qualité de ses produits, mais aussi par son engagement envers l'innovation constante. Leurs recherches et développements visent à anticiper les tendances du marché et à fournir des outils qui facilitent le travail des utilisateurs tout en garantissant une performance optimale, ce qui en fait un partenaire de choix dans le secteur de l'outillage.","Découvrez l'ingéniosité des produits Alemite chez Outillage Placide Mathieu. Explorez nos adaptateurs, raccords et colliers de serrage, conçus pour une performance optimale. Transformez vos projets avec des outils de qualité. Visitez Placide.com."
fr,Ameta Solution,"Ameta Solution est une marque qui se dédie à l'innovation et à l'efficacité dans le domaine de l'outillage. Fondée avec la volonté de répondre aux besoins des professionnels et des particuliers, Ameta s'engage à offrir des produits de qualité, alliant performance et praticité. Leur mission repose sur la satisfaction client et la recherche constante de solutions adaptées aux défis rencontrés sur le terrain.

La gamme d'outillage Ameta est variée et adaptée à de multiples secteurs. Parmi leurs produits phares, on trouve des solutions de nettoyage comme des savons et des lingettes, mais aussi des distributeurs pour une utilisation pratique dans divers environnements. Ils proposent également des fraises annulaires en acier haute vitesse, idéales pour les travaux d'usinage, témoignant ainsi de leur capacité à répondre à des besoins techniques spécifiques tout en assurant une manipulation facile et efficace.

Un fait saillant à propos d'Ameta Solution est leur engagement en faveur de l’environnement, en mettant au point des produits qui minimisent l’impact écologique tout en maintenant des standards de qualité élevés. Cette approche responsable fait d'eux un choix de confiance pour ceux qui cherchent non seulement des outils performants, mais également soucieux de l'avenir de notre planète.","Découvrez la gamme Ameta Solution chez Outillage Placide Mathieu : des savons, lingettes et distributeurs pour un nettoyage efficace et pratique. Équipez-vous des meilleurs outils pour votre hygiène. Visitez Placide.com."
fr,Metaflux,"Metaflux est une marque reconnue dans le domaine des solutions de lubrification et de protection des métaux, fondée en Allemagne. Sa mission est de fournir des produits innovants et de haute qualité, conçus pour améliorer l’efficacité et la durabilité des outils et machines. Metaflux s’engage à répondre aux exigences des professionnels et des bricoleurs en proposant des solutions fiables qui simplifient les tâches liées à l’outillage.

Leurs produits incluent une gamme étendue de lubrifiants, notamment des lubrifiants de coupe et de perçage, formulés pour optimiser les performances lors de travaux en métal. Que ce soit pour le perçage, le fraisage ou tout autre processus d'usinage, Metaflux offre des solutions adaptées qui garantissent une coupe précise et efficace tout en préservant l’intégrité des outils.

Méticuleux dans leur approche, Metaflux se distingue également par son engagement en faveur de l'environnement, en développant des produits moins nocifs et en promouvant des pratiques durables. Leur expertise technique et leur recherche constante d’innovation font de Metaflux un choix privilégié pour ceux qui recherchent des outils et des lubrifiants de qualité supérieure.",Découvrez la gamme d'outils Metaflux chez Outillage Placide Mathieu. Optimisez vos perforations et découpes avec nos lubrifiants en mousse spécifiquement conçus pour les performances maximales. Visitez Placide.com.
fr,Ancra,"Ancra est une marque reconnue dans le domaine de l'outillage, fondée sur des principes d'innovation et de durabilité. La mission d'Ancra est de fournir des solutions d'arrimage et de levage qui répondent aux besoins des professionnels en matière de sécurité et d'efficacité. En intégrant la technologie au service de l’utilisateur, la marque s'efforce de créer des produits fiables qui facilitent les tâches les plus exigeantes.

Leurs gammes d'outillage incluent principalement des dispositifs d'arrimage et de levage, tels que des élingues, des crochets et des tendeurs. Chaque produit est conçu avec attention pour garantir robustesse et fonctionnalité, que ce soit pour des applications industrielles ou des projets de bricolage. Grâce à des matériaux de haute qualité et à une conception astucieuse, Ancra s'assure que chaque utilisateur bénéficie d'un outillage à la fois sûr et efficace.

Un fait remarquable à propos d'Ancra est son engagement envers la durabilité. La marque vise à minimiser son impact environnemental en utilisant des processus de fabrication responsables et en proposant des produits qui non seulement permettent un usage prolongé, mais également sont recyclables. Ce souci de l'environnement témoigne de leur volonté de contribuer à un avenir plus durable pour l'industrie de l'outillage.","Découvrez notre sélection d’outils de levage et d'arrimage Ancra, alliant robustesse et fiabilité pour tous vos projets. Trouvez l’élingue parfaite, le crochet mousqueton en acier, et bien plus encore. Visitez Placide.com."
fr,Apex,"Apex est une marque reconnue pour son engagement envers la qualité et l'innovation dans le domaine de l'outillage. Fondée avec la mission de fournir des outils fiables aux professionnels et aux bricoleurs, Apex vise à simplifier le travail de ses utilisateurs tout en garantissant durabilité et performance. Avec des années d'expérience dans l'industrie, la marque se concentre sur la recherche constante de solutions pratiques.

L'outillage Apex comprend une vaste gamme de produits, allant des embouts plats aux douilles à chocs, adaptés à divers besoins d'assemblage et de réparation. Les embouts plats disponibles dans différentes tailles sont spécialement conçus pour s'adapter à des applications précises, tandis que les douilles à chocs, courtes et longues, garantissent une compatibilité optimale avec un large éventail de renvois d'outils. Chaque produit est pensé pour offrir une performance optimale, rendant les tâches manuelles plus efficaces et sécurisées.

Un aspect notable d'Apex est son investissement dans l'innovation. La marque utilise des matériaux de haute qualité et des méthodes de fabrication avancées pour assurer que chaque outil puisse résister aux exigences du travail quotidien. Grâce à sa recherche continue et son développement de nouveaux produits, Apex se positionne comme un acteur clé sur le marché de l'outillage, répondant aux attentes croissantes des utilisateurs modernes.","Découvrez les embouts plats de la marque Apex, alliant qualité et performance pour tous vos besoins en bricolage. Parfaits pour vos projets, ces outils emblématiques garantiront des résultats professionnels. Visitez Placide.com."
fr,Arbortech,"Arbortech est une marque australienne fondée avec la vision d'innover dans le domaine de l'outillage, en offrant des solutions adaptées aux besoins des professionnels de la construction et de l'artisanat. Leur mission est de développer des outils qui améliorent l'efficacité et la précision tout en garantissant une expérience utilisateur optimale. Cela se reflète dans leur approche centrée sur la recherche et l'innovation, visant à offrir des produits de haute qualité.

L'offre d'Arbortech se concentre sur des outils électroportatifs spécialisés dans la découpe de matériaux tels que la brique et le mortier. Parmi leurs produits phares, on trouve des scies à mortier et brique qui allient performance et maniabilité, permettant de réaliser des travaux de précision. Leur gamme s'étend également à des lames adaptées à divers usages, offrant flexibilité et efficacité pour les projets de construction ou de rénovation.

Un fait remarquable sur Arbortech est son engagement envers la durabilité et la sécurité. La marque met un point d’honneur à concevoir des outils qui non seulement améliorent les performances, mais réduisent également les risques d'accidents lors de leur utilisation. Cette philosophie témoigne de leur volonté de contribuer positivement à l'industrie tout en respectant l'environnement.","Découvrez notre sélection d'outils Arbortech, comprenant des scies à mortier et à brique électriques de haute qualité ainsi que des lames tout usage. Conçu pour les professionnels et passionnés, nos produits garantissent performance et précision. Visitez Placide.com."
fr,Aro,"Aro est une marque d'outillage reconnue pour son engagement envers l'innovation et la qualité. Fondée avec la mission de fournir des solutions pratiques et efficaces pour les professionnels et les amateurs du bricolage, Aro a su s'imposer comme un acteur incontournable dans le domaine des outils de travail. Chaque produit est conçu avec soin, en intégrant les dernières avancées technologiques pour répondre aux besoins variés de ses utilisateurs.

La gamme d'outillage Aro se caractérise par sa diversité et sa robustesse. Les produits incluent des équipements variés, tels que des raccords automatiques, qui facilitent les connexions dans divers contextes. L'accent mis sur la durabilité et l'efficacité permet à Aro de s'adapter aux exigences des projets les plus ambitieux, tout en garantissant une utilisation simplifiée.

Un fait remarquable sur Aro est leur collaboration étroite avec des professionnels du secteur. Cette démarche leur permet de rester à l'écoute des attentes des utilisateurs et d'affiner constamment leurs produits en fonction des retours du terrain. Ainsi, Aro s'affirme non seulement comme une marque de confiance, mais aussi comme un partenaire essentiel pour ceux qui cherchent à optimiser leur travail avec des outils fiables et performants.","Découvrez notre sélection d'outils Aro, comprenant des raccords automatiques mâles et bien plus. Profitez de la qualité et de la performance de ces équipements pour tous vos projets. Visitez Placide.com pour en savoir plus !"
fr,Arrow,"Arrow est une marque reconnue pour son engagement envers la qualité et l'innovation dans le domaine de l'outillage. Fondée avec la mission de fournir des solutions pratiques et fiables aux professionnels comme aux bricoleurs, Arrow s’efforce de rendre les projets d'assemblage et de réparation simples et accessibles. Leur approche centrée sur le client a façonné leur réputation au fil des ans, leur permettant de se démarquer dans un marché compétitif.

La gamme d'outillage Arrow est variée, mettant l'accent principalement sur les agrafes et les outils de fixation. Que ce soit pour des travaux de construction, de rénovation ou de bricolage, les agrafes d’Arrow, disponibles en plusieurs tailles et formats, répondent aux besoins des utilisateurs les plus exigeants. Avec un choix allant d'agrafes classiques pour des projets légers à des options plus robustes pour des applications professionnelles, chaque produit est conçu pour garantir un maintien sûr et durable.

Un fait intéressant à propos d'Arrow est leur longue histoire d’excellence, qui remonte à plusieurs décennies. Réputée pour sa capacité à innover tout en respectant des normes élevées, la marque a su s’adapter aux évolutions du marché et des technologies, tout en restant fidèle à ses valeurs de qualité et de performance. Cette résilience et cet engagement envers l'amélioration continue sont au cœur du succès d'Arrow dans le secteur de l'outillage.","Découvrez la qualité des attaches Arrow chez Outillage Placide Mathieu. Idéales pour tous vos projets, nos agrafes assurent une fixation solide et durable. Faites le choix de la fiabilité et de l’efficacité. Visitez Placide.com."
fr,Baldor,"Baldor est une marque reconnue pour son engagement envers la qualité et l'innovation dans le domaine de l'outillage. Fondée aux États-Unis, Baldor s'est donné pour mission de fournir des produits qui allient performance et durabilité, répondant ainsi aux besoins des professionnels et des bricoleurs. Leur approche centrée sur l'utilisateur reflète une volonté constante d’améliorer l’efficacité et la sécurité des outils dans les environnements de travail.

La gamme d'outillage proposée par Baldor comprend divers équipements adaptés aux exigences industrielles. Parmi ces produits, on trouve des tourets d'établi robustes, idéaux pour le travail du métal, ainsi que des accessoires tels que des visières de protection, garantissant la sécurité des utilisateurs lors de leur utilisation. Ces outils sont conçus pour offrir une performance optimale tout en résistant à un usage intensif.

Un fait marquant concernant Baldor est son partenariat avec des fabricants de premier plan pour assurer une qualité exceptionnelle. En investissant continuellement dans la recherche et le développement, la marque s’efforce de rester à la pointe de la technologie dans le secteur, consolidant ainsi sa réputation d'excellence et sa présence sur le marché mondial de l’outillage.","Découvrez notre sélection d'outils Baldor, incluant des tourets d'établi industriels et des vitres de protection. Qualité et performance garanties pour tous vos projets. Visitez Placide.com !"
fr,DeWALT,"DeWALT est une marque emblématique fondée en 1924, reconnue pour sa volonté d'innovation et son engagement envers les professionnels du bâtiment. L'objectif de la marque est de fournir des outils puissants et fiables qui répondent aux exigences les plus élevées des métiers du bâtiment. Avec un héritage solide, DeWALT s'est imposée comme une référence dans le secteur de l'outillage, alliant performance et durabilité.

L'éventail d'outils proposés par DeWALT est vaste, allant des perceuses et scies aux accessoires essentiels comme les tampons de soutien et les boulons de remplacement. Leur gamme est conçue pour répondre aux besoins variés des artisans, que ce soit pour des travaux de précision ou des tâches plus robustes. Chaque produit est pensé pour optimiser l'efficacité et la sécurité sur les chantiers, garantissant une expérience utilisateur optimale.

Un fait saillant à propos de DeWALT est sa capacité à rester à la pointe de la technologie, en intégrant des innovations telles que la connectivité Bluetooth dans ses outils sans fil. Cela permet aux utilisateurs de surveiller et de gérer leurs outils via une application mobile, facilitant la gestion des stocks et l'entretien. Cette approche tournée vers l'avenir témoigne de l'engagement de DeWALT à simplifier la vie des professionnels tout en améliorant leur productivité.","Découvrez notre sélection d'outils DeWALT chez Outillage Placide Mathieu. Trouvez des produits de qualité, comme des boulons de remplacement et des tampons de soutien, pour vos projets. Visitez Placide.com pour en savoir plus !"
fr,DEWALT,"DEWALT est une marque emblématique fondée en 1924, reconnue pour son engagement envers l'innovation et la qualité dans le domaine de l'outillage. Sa mission est de concevoir des outils robustes et durables qui répondent aux exigences des professionnels et des artisans, tout en facilitant leur travail au quotidien. DEWALT s'efforce de repousser les limites de la technologie pour offrir des performances optimales sur le terrain.

La gamme d'outils DEWALT est vaste, allant des perceuses puissantes aux scies polyvalentes, en passant par des accessoires indispensables tels que les crochets de ceinture. Chaque produit est conçu pour assurer une ergonomie optimale, garantissant ainsi sécurité et confort lors de l'utilisation. Que ce soit pour le bricolage ou des travaux professionnels, les outils DEWALT allient puissance et précision.

Un fait marquant à propos de DEWALT est leur engagement envers la durabilité et la responsabilité environnementale. En intégrant des pratiques de fabrication écoresponsables et des matériaux recyclables dans leurs processus, DEWALT contribue à la préservation de l'environnement tout en offrant des outils de haute performance aux utilisateurs du monde entier.","Découvrez la gamme d'outils DEWALT chez Outillage Placide Mathieu, incluant le crochet de ceinture, pour des performances inégalées. Équipez-vous avec des produits de qualité qui simplifient tous vos projets. Visitez Placide.com."
fr,Ben-Mor,"Ben-Mor est une marque reconnue pour son engagement à fournir des outils et accessoires de haute qualité. Fondée sur la passion de l’outillage, la mission de Ben-Mor est de rendre le travail des professionnels plus efficace grâce à des produits fiables et innovants, adaptés à divers secteurs d’activité. Leur approche vise à allier performance et sécurité, assurant ainsi la satisfaction des utilisateurs au quotidien.

Le catalogue de Ben-Mor comprend une large gamme d’outils, allant des tendeurs à chaîne aux élingues synthétiques. Chaque produit est conçu dans le respect des normes de sécurité les plus strictes, alliant robustesse et durabilité. Que ce soit pour des projets de construction, de manutention ou d'entretien, Ben-Mor offre des solutions qui répondent aux défis rencontrés par les professionnels.

Un fait notable sur le fournisseur Ben-Mor est son investissement constant dans la recherche et le développement. Cela leur permet de rester à la pointe de l'innovation, en proposant des produits non seulement performants mais aussi adaptés aux évolutions technologiques et aux exigences du marché, faisant ainsi d'eux un partenaire incontournable dans le domaine de l'outillage.","Découvrez notre sélection d'outils Ben-Mor, incluant des tendeurs à chaîne et élingues synthétiques de qualité pour tous vos projets. Fiabilité et performance garanties. Visitez Placide.com pour en savoir plus !"
fr,X-Stream,"X-Stream est une marque reconnue pour son engagement envers la qualité et l'innovation dans le domaine de l'outillage. Fondée sur des principes de durabilité et de performance, elle vise à fournir des outils fiables qui répondent aux besoins des professionnels et des amateurs de bricolage. L'objectif de X-Stream est d’allier technologie de pointe et accessibilité, permettant à chacun d’atteindre des résultats exceptionnels dans ses projets.

La gamme d’outillage X-Stream englobe une variété de produits adaptés à divers travaux, notamment des compresseurs à essence performant et des nettoyeurs haute-pression puissants. Chaque produit est conçu pour offrir une efficacité optimale et faciliter les tâches les plus exigeantes, que ce soit pour des applications domestiques ou industrielles. Les outils de X-Stream se distinguent par leur robustesse et leur facilité d'utilisation, rendant chaque projet plus accessible.

Un fait remarquable sur le fournisseur de X-Stream est leur engagement envers l'innovation écologique. En intégrant des technologies visant à réduire la consommation d'énergie et les émissions, ils s’efforcent de promouvoir une approche durable tout en offrant des outils performants. Cette philosophie leur permet de se démarquer dans un secteur compétitif, tout en répondant aux attentes croissantes des consommateurs soucieux de l'environnement.","Découvrez les performances des outils X-Stream chez Outillage Placide Mathieu. Que ce soit pour un compresseur à essence ou un nettoyeur haute-pression, nous avons ce qu'il vous faut pour chaque projet. Visitez Placide.com."
fr,BERKSHIRE,"Berkshire est une marque qui a su se forger une réputation solide dans l'univers de l'outillage. Fondée avec la mission de fournir des outils de qualité accessibles à tous, Berkshire se consacre à l’innovation et à la durabilité. Sa philosophie repose sur l'idée que des outils fiables peuvent transformer l'expérience de travail, que ce soit pour les professionnels ou les bricoleurs passionnés.

Leurs produits se distinguent par une capacité à répondre aux besoins variés des utilisateurs. Berkshire propose une gamme complète de forets à métal, conçus pour offrir précision et performance dans des applications diverses. Que ce soit pour percer, fraiser ou réaliser des travaux de finition, chaque outil est minutieusement élaboré pour garantir des résultats optimaux et un usage prolongé.

Un fait notable sur Berkshire est son engagement envers des pratiques de fabrication écoresponsables. L'entreprise met un point d'honneur à réduire son empreinte carbone tout en maintenant des standards élevés de qualité. Cet équilibre entre innovation et responsabilité fait de Berkshire un choix de confiance parmi les professionnels qui recherchent des outils durables et efficaces.","Découvrez notre sélection de forets à métal de la marque Berkshire, adaptés pour tous vos travaux de perçage. Qualité et performance au rendez-vous pour un résultat impeccable. Visitez Placide.com pour en savoir plus !"
