langue,marque,description,meta_description
fr,Bahco,"Bahco est une marque emblématique d’outillage, fondée en Suède en 1886. Elle a été créée avec la mission de développer des outils innovants qui répondent aux besoins des artisans et des professionnels. Grâce à un engagement constant envers la qualité et l'ergonomie, Bahco s'est imposée comme un leader dans l'industrie, alliant tradition et modernité dans chaque produit.

La gamme d’outillage Bahco est vaste et variée, allant des clés à molette aux pinces, en passant par les tournevis et les scies. Chaque outil est conçu pour offrir une performance optimale et une durabilité à toute épreuve. Par exemple, la clé à molette avec pince alligator de 8 pouces illustre parfaitement l'expertise de la marque, alliant maniabilité et robustesse, idéale pour un usage intensif.

Un fait marquant concernant Bahco est son engagement en faveur de l'innovation durable. La marque investit dans des techniques de fabrication respectueuses de l'environnement, utilisant des matériaux recyclables. Ce souci pour l'écologie témoigne d'une vision à long terme qui intéresse de plus en plus les consommateurs soucieux de leur impact environnemental.","Découvrez les outils Bahco chez Outillage Placide Mathieu : clés à molette, pinces et plus encore pour tous vos projets. Qualité et fiabilité au rendez-vous. Visitez Placide.com pour explorer notre sélection complète !"
fr,WILPU,"WILPU est une marque d'outillage allemande qui a su s'imposer grâce à son savoir-faire et son engagement envers la qualité. Fondée sur des valeurs d'innovation et de durabilité, WILPU vise à fournir des produits performants qui répondent aux besoins des artisans et des bricoleurs. L'entreprise s’appuie sur des procédés de fabrication rigoureux pour garantir une fiabilité constante.

Le catalogue de WILPU propose une large gamme d'outils, notamment des lames de scie alternatives, adaptées à différentes applications, que ce soit pour l'isolation ou d'autres matériaux. Les produits sont conçus pour offrir une précision et une efficacité maximales, permettant ainsi aux utilisateurs de réaliser leurs projets avec succès. Qu'il s'agisse de travaux de rénovation ou de constructions, chaque outil est pensé pour optimiser les performances.

Un des aspects remarquables de WILPU est son engagement envers l'environnement. La marque met un point d'honneur à adopter des pratiques de fabrication écoresponsables et à développer des produits durables. Cela fait de WILPU non seulement un leader sur le marché de l’outillage, mais aussi un acteur engagé en faveur d’une consommation responsable et durable.","Découvrez notre sélection de lames de scie alternative WILPU, idéales pour vos travaux d'isolation. Performantes et durables, elles répondront à tous vos besoins en bricolage. Faites confiance à Outillage Placide Mathieu pour vos projets. Visitez Placide.com."
fr,Young Bros. Stamp Works,"Young Bros. Stamp Works, fondée par une équipe passionnée d'artisans et d'innovateurs, est une marque qui incarne l'héritage et la tradition du travail manuel. Leur mission est claire : fournir aux artisans et aux passionnés de bricolage des outils de marque d'excellence pour réaliser des créations uniques. Grâce à un savoir-faire reconnu et un engagement envers la qualité, Young Bros. s'efforce d'inspirer la créativité dans chaque projet.

La marque propose une gamme variée d'outils de marquage, notamment des ensembles de poinçons à marquer disponibles en différentes tailles et styles, allant des chiffres aux lettres. Ces outils permettent de personnaliser des objets en métal, en cuir ou en bois, offrant ainsi aux utilisateurs la possibilité de donner vie à leurs idées de manière précise et soignée. Que ce soit pour des travaux professionnels ou des projets personnels, chaque outil est conçu pour répondre aux besoins des utilisateurs les plus exigeants.

Un fait saillant sur Young Bros. Stamp Works est leur engagement envers l'innovation et la durabilité. Ils s'approvisionnent en matières premières de haute qualité et mettent en œuvre des pratiques de fabrication respectueuses de l'environnement, ce qui contribue à la longévité de leurs produits. Cet engagement fait de la marque un choix privilégié pour ceux qui recherchent des outils fiables et responsables.","Découvrez notre sélection d'outils Young Bros. Stamp Works pour le marquage : poinçons de haute qualité pour créer des inscriptions précises et durables. Parfaits pour vos projets de bricolage. Visitez Placide.com."
en,Airmax,"Airmax emerged with a commitment to innovation and reliability in the world of fluid control solutions. Founded with the mission to provide high-quality tools that ensure optimal performance and safety, Airmax has become a trusted name among professionals and DIY enthusiasts alike. Their focus on precision engineering and user-friendly designs reflects a dedication to meeting the needs of an evolving industry.

The product range from Airmax is extensive, featuring a variety of essential tools designed for fluid management and pneumatic applications. Among their offerings are various ball valves, check valves, and safety valves, each designed to perform efficiently in demanding environments. Airmax pays close attention to materials and construction to ensure durability and reliability, making their tools suitable for both commercial and residential tasks.

One noteworthy aspect of Airmax is their commitment to quality assurance and customer satisfaction. The company implements stringent testing protocols to guarantee that each product meets high industry standards. This attention to detail has helped Airmax to build a reputation for excellence, ensuring that each tool not only meets but often exceeds user expectations in performance and longevity.","Explore our premium Airmax tools, featuring high-quality ball valves and safety valves designed for efficiency and reliability. Elevate your projects with our trusted products. Visit Placide.com for more!"
en,Ajax,"Ajax is a respected brand with a rich heritage in the tools industry, dedicated to providing high-quality solutions for both professionals and DIY enthusiasts. Founded with a mission to enhance craftsmanship through durable and reliable tools, Ajax prides itself on innovation, ensuring that its products not only meet but exceed performance expectations in demanding environments.

The range of tools offered by Ajax is extensive, specifically designed to cater to a variety of applications. From chisels and retainers to chucks suitable for square drives, each tool reflects a commitment to precision and durability. The design of Ajax tools ensures compatibility with various equipment, making them versatile additions to any toolkit.

An interesting fact about Ajax as a supplier is their relentless focus on quality control. All products undergo rigorous testing before reaching the market, ensuring that users can trust in the performance and longevity of their tools. This commitment to excellence has solidified Ajax’s reputation as a reliable choice for those serious about their work.","Discover high-quality Ajax tools at Outillage Placide Mathieu. Explore our range, including versatile chucks and durable chisels to enhance your projects. Equip yourself with the best in craftsmanship. Visit Placide.com for more details!"
en,Alemite,"Alemite, a brand with a rich history rooted in innovation, has been serving the lubrication equipment industry since its founding in the early 20th century. With a steadfast mission to enhance efficiency and reliability for its users, Alemite has consistently focused on delivering high-quality products that simplify maintenance and improve performance across various applications. Their commitment to excellence is woven into the very fabric of their operations, reflecting a dedication to high standards and customer satisfaction.

The range of tools offered by Alemite is diverse and expertly designed to cater to the needs of professionals across multiple trades. From hydraulic couplers to hose clamps and specialized fittings, each product is engineered for precise functionality, ensuring seamless operation in demanding environments. Alemite’s tools are particularly valued for their durability and effectiveness, making them essential for anyone reliant on hydraulic systems and lubrication processes.

One notable fact about Alemite is its focus on sustainability and environmental responsibility. The company actively seeks innovative ways to reduce waste and improve energy efficiency in its products, reflecting a broader commitment to environmental stewardship. This dedication not only enhances the performance of their tools but also aligns with the growing emphasis on sustainable practices within the industry.","Explore top-quality Alemite products at Outillage Placide Mathieu! Discover advanced fittings, hose clamps, and couplers designed for exceptional performance and reliability. Elevate your projects with our premium tools. Visit Placide.com!"
en,Ameta Solution,"Ameta Solution originated with a clear mission to provide innovative cleaning and maintenance solutions that enhance efficiency and safety in various working environments. With a commitment to quality and effectiveness, the brand strives to support professionals across industries by delivering reliable products that meet the highest standards. The brand's dedication to sustainability and customer satisfaction is central to its operations, reflecting its essence in every formulation and product design.

The range of tools offered by Ameta Solution includes a variety of hand cleaners, both in wipes and liquid form, designed for effective cleanliness in industrial and commercial settings. Their products cater to the unique needs of different user types, providing options such as dispensers and replacement systems that ensure ease of use and reliability. Their selection also features high-speed steel annular cutters that exemplify their focus on durability and precision, allowing users to tackle demanding tasks with confidence and efficiency.

A key aspect of Ameta Solution is its emphasis on research and development, ensuring that their products stay at the forefront of technology and effectiveness. This proactive approach allows them to continuously improve their offerings and adapt to market needs, cementing their position as a trusted supplier in the hardware and tools industry.","Discover top-quality Ameta Solution products at Outillage Placide Mathieu. From effective hand cleaners and convenient dispensers to specialized soap replacement pumps, we have everything you need for a cleaner workspace. Visit Placide.com today!"
en,Metaflux,"Metaflux is a renowned brand that originated in Germany, where it has established a strong reputation for delivering high-quality products designed for professionals and DIY enthusiasts alike. The mission of the brand revolves around innovation and efficiency, focusing on providing solutions that enhance the performance and longevity of tools and materials. Metaflux strives to meet the specific needs of users, ensuring their tools facilitate seamless operation in various applications.

The product range offered by Metaflux includes a diverse selection of specialized lubricants, cutting fluids, and maintenance solutions that cater to multiple industries. Their foam cutting and drilling lubricants, for example, are engineered to reduce friction, prolong tool life, and improve precision during cutting operations. Each product embodies the brand’s commitment to quality, ensuring that users can rely on their tools to perform under demanding conditions.

As a testament to its expertise in the field, Metaflux has been dedicated to research and development since its inception. The company continuously invests in advanced technologies and laboratory testing, enabling them to stay at the forefront of innovation. This dedication not only enhances the reliability of their products but also positions Metaflux as a trusted partner in the tool and hardware industry.","Discover the exceptional range of Metaflux products at Outillage Placide Mathieu, including advanced foam cutting and drilling lubricants. Enhance your projects with our top-quality tools and solutions. Visit Placide.com."
en,Ancra,"Ancra originated from a commitment to creating high-quality lifting and securing solutions, prioritizing safety and durability. With a strong emphasis on innovation, the brand emerged to support industries that require dependable tools for both heavy-duty and everyday applications. Ancra’s mission is to deliver products that empower users to perform tasks with confidence, ensuring that every tool meets stringent quality standards.

The range of tools offered by Ancra includes a variety of lifting slings, tie-downs, and rope stands, designed for versatility and reliability. Each tool is crafted to accommodate various needs, whether for industrial use or personal projects. Ancra focuses on engineering solutions that provide strength and efficiency, ensuring that users have the right equipment to tackle any job safely.

A notable fact about Ancra is their dedication to sustainability and quality assurance. Each product undergoes rigorous testing to meet industry standards, demonstrating the brand's commitment to reducing environmental impact while providing exceptional performance. This blend of reliability and responsibility has earned Ancra a respected place among professionals and DIY enthusiasts alike.","Discover Ancra's premium lifting and securing solutions, including durable lifting slings, robust snap hooks, and reliable ratchet tie-downs. Elevate your projects with quality tools designed for performance. Visit Placide.com for more!"
en,Apex,"Apex originated with a commitment to creating high-quality tools that meet the rigorous demands of both professionals and DIY enthusiasts. Founded on the principle of precision and durability, the brand's mission has always been to deliver reliable tools that enhance productivity and simplify tasks, ensuring every user can achieve their best results.

The product range offered by Apex includes a diverse selection of screwdriver bits and impact sockets, meticulously designed for various applications. Each tool is engineered for reliability, with specific attention to fit and performance, catering to the needs of various trades, from automotive to construction. Their screwdriver bits excel in versatility and precision, while the impact sockets stand out for their strength and durability, making them essential for any toolbox.

A notable fact about Apex is its dedication to innovation and quality control, with each product undergoing rigorous testing before reaching the market. This commitment to excellence not only sets Apex apart but also assures users that they are investing in tools that will withstand the test of time and provide the performance they expect.",Discover the precision and quality of Apex screwdriver bits at Outillage Placide Mathieu. Our selection includes a variety of slotted bits designed for durability and performance. Elevate your tool collection today. Visit Placide.com.
en,Arbortech,"Arbortech originated in Australia, where its mission has always been to provide innovative and high-quality tools specifically designed for construction and masonry professionals. Since its inception, the brand has focused on developing unique solutions that enhance efficiency and precision, enabling tradespeople to tackle even the most challenging tasks with confidence. Arbortech's commitment to quality and customer satisfaction is demonstrated through continuous research and development efforts.

The product range offered by Arbortech includes advanced cutting technology tailored for brick and mortar work, which allows for a seamless and efficient experience. With tools designed to handle various applications—such as general-purpose cutting, tuckpointing, and precise plunge cuts—Arbortech ensures that professionals have the right equipment to achieve their desired results in masonry projects. Their tools are engineered to deliver exceptional performance while maintaining user safety and ease of operation.

A notable fact about Arbortech is that it has garnered a loyal following within the construction community due to its reputation for creativity in tool design. The brand strives to push boundaries, continually innovating to meet the evolving needs of professionals. Arbortech not only provides tools, but it also fosters a culture of excellence, consistently aiming to enhance productivity and craftsmanship in every project.",Discover high-quality Arbortech tools at Outillage Placide Mathieu! Explore innovative solutions like the AS175 Allsaw and advanced masonry cutting technology. Perfect for all your brick and mortar projects. Visit Placide.com for more!
en,Aro,"Aro is a trusted brand with roots that trace back several decades, dedicated to providing high-quality fluid handling solutions. Their mission is to enhance efficiency and reliability in various industries by delivering tools that meet the demanding needs of professionals. Aro’s commitment to innovation and excellence ensures that every product is engineered to perform at the highest standards.

The range of tools offered by Aro includes an impressive selection of couplers, regulators, pumps, and air control devices. Each tool is designed with precision to facilitate seamless integration into a variety of applications, be it in manufacturing, maintenance, or construction. The brand is especially well-known for its Male Automatic coupler, which showcases their excellence in fluid transfer technology.

One key fact about Aro is their unwavering focus on sustainability and environmental responsibility. They continually strive to develop products that not only improve efficiency but also minimize waste and impact. This dedication to both performance and sustainability makes Aro a leader in the industry, earning them a reputation as a go-to brand among professionals seeking reliability and innovation.","Explore premium Aro products at Outillage Placide Mathieu, featuring high-quality tools like the Male Automatic Coupler. Enhance your projects with reliable performance and durability. Visit Placide.com for more exceptional tools and great offers!"
en,Arrow,"Arrow has a rich history rooted in innovation, having been established with the mission to offer reliable fastening solutions for both professionals and DIY enthusiasts. The brand is committed to providing tools that enhance efficiency and precision, empowering users to tackle a wide range of projects with confidence. By focusing on quality and performance, Arrow has positioned itself as a respected name in the hardware industry.

The range of tools offered by Arrow showcases their expertise in fastening technologies, particularly through their diverse selection of staples and staple guns. These tools are designed for versatility, catering to various applications from woodworking to upholstery. Arrow staples come in different sizes and configurations, ensuring users can find the right fit for their specific needs, whether for home improvement tasks or professional jobs.

A notable fact about Arrow is their dedication to sustainability. With an eye towards minimizing environmental impact, they continuously explore methods to enhance their manufacturing processes and product designs. This commitment not only supports eco-friendly practices but also resonates with customers who value responsible sourcing and production in their purchasing decisions.","Discover the high-quality Arrow staples at Outillage Placide Mathieu. Perfect for any project, these reliable staples ensure sturdy fastening solutions for your needs. Explore our collection and elevate your tool game. Visit Placide.com for more!"
en,Baldor,"Baldor Electric Company has a rich history dating back to 1920, with a mission focused on delivering high-quality electric motors and related products to the industrial sector. With a commitment to innovation and reliability, Baldor has established itself as a trusted brand among professionals who rely on consistent performance to drive their operations. The company's dedication to excellence is evident in its rigorous manufacturing processes, ensuring that each product meets the highest standards.

Baldor offers a wide range of tools designed for industrial applications, including robust bench grinders and various accessories to enhance performance and safety. Their products, like the industrial bench grinders and customized eyes shields, are engineered to meet the demands of heavy-duty use, providing durability and efficiency to users. Baldor’s tools cater to both professionals and serious enthusiasts, emphasizing functionality and safety without compromising quality.

A key fact about Baldor is its integration into the ABB Group in 2013, which further solidified its position as a leader in the energy-efficient electric motor segment. This partnership has allowed Baldor to leverage additional resources and technological advancements, enhancing its product line and expanding its reach. As a result, customers can trust Baldor tools to incorporate cutting-edge technology while maintaining the brand’s commitment to high performance and reliability.","Discover top-quality Baldor tools at Outillage Placide Mathieu! From robust bench grinders to essential eye shields, we have everything you need for your projects. Explore our selection and elevate your craft. Visit Placide.com!"
en,DeWALT,"DeWALT is a well-respected brand that originated in the United States during the 1920s, founded by a woodworking machinery innovator named Raymond DeWalt. With a mission to engineer durable and efficient tools for professionals and DIY enthusiasts alike, the brand has built a reputation grounded in quality and performance. DeWALT commits to enhancing productivity through innovation, ensuring their tools not only meet but exceed the demands of a competitive market.

Known for their extensive range, DeWALT offers a variety of tools that cater to different applications, from power tools to hand tools and accessories. The brand excels in creating equipment designed for masonry, woodworking, metalworking, and construction. Products like the M8 blade bolt and 5"" Velcro backing pad illustrate their commitment to high-quality components that enhance functionality and user experience, reflecting their dedication to crafting tools that professionals trust on job sites.

An important aspect of DeWALT is its focus on sustainability. The company actively incorporates environmentally friendly practices in its manufacturing processes, striving to reduce its carbon footprint while maintaining high standards of quality and performance. This commitment to responsible manufacturing not only enhances the brand's credibility but also appeals to a growing segment of consumers who value sustainability in their purchasing decisions.","Discover high-quality DeWALT tools at Outillage Placide Mathieu. Explore our selection of M8 blade bolts, durable Velcro backing pads, and reliable replacement bit holders to enhance your projects. Visit Placide.com for more!"
en,DEWALT,"DEWALT has built a legacy since its inception in 1924, committed to delivering high-quality tools that cater to the needs of professionals and DIY enthusiasts alike. Originating from the vision of its founder, Raymond E. Dewalt, the brand's mission centers around innovation and durability, ensuring that every product empowers users to achieve superior results on every job.

The diverse range of tools offered by DEWALT includes power tools, hand tools, and accessories designed for various applications. From robust drills and saws to convenient belt clips and hooks, each item embodies the brand's dedication to quality and performance, making them a staple in workshops and construction sites.

A key fact about DEWALT is its commitment to sustainability and environmental responsibility. The brand not only focuses on producing tools that enhance productivity but also strives to implement practices that minimize their ecological footprint, ensuring that their innovation benefits both users and the planet.","Discover high-quality DEWALT tools at Outillage Placide Mathieu. Explore our extensive range, including durable belt clips/hooks and more. Elevate your projects with reliable equipment that professionals trust. Visit Placide.com for your perfect tool."
