langue,marque,description,meta_description
fr,Marathon,"Marathon est une marque reconnue dans le secteur de l'outillage, fondée avec la mission de fournir des outils fiables et durables pour les professionnels et les bricoleurs. Avec une attention particulière portée à la qualité et à l'innovation, Marathon s'efforce de rendre chaque projet plus facile et plus efficace, en s'engageant à répondre aux besoins variés de ses utilisateurs.

Leurs produits couvrent une large gamme d'outils, allant des lames de scie spécialement conçues pour travailler des matériaux tels que le plastique, le PVC et le fibro-ciment, jusqu'aux accessoires essentiels pour des performances optimales. Marathon s'engage à concevoir des outils qui non seulement facilitent le travail, mais contribuent également à la sécurité et au confort de l'utilisateur.

Un fait marquant à propos de Marathon est son engagement envers une production durable et responsable. La marque collabore avec des fournisseurs qui partagent cette vision, ce qui assure des produits non seulement performants, mais également respectueux de l'environnement. Ce souci d'intégrer l'écologie dans le processus de fabrication souligne la place de Marathon en tant qu'acteur conscient de son impact sur la planète.","Découvrez la qualité des outils Marathon chez Outillage Placide Mathieu. Parfaites pour le plastique, le PVC et le fibro ciment, nos lames de scie offrent des performances inégalées. Visitez Placide.com pour explorer notre gamme complète !"
fr,Marples,"Marples est une marque légendaire d'outillage, fondée au 19e siècle en Angleterre. Au fil des années, son objectif a été de fournir des outils de haute qualité qui répondent aux besoins des artisans et des passionnés de la menuiserie. Avec un héritage riche, Marples s'engage à allier tradition et innovation pour offrir des produits qui durent.

La gamme d'outils Marples est principalement composée de ciseaux à bois de différentes tailles, adaptés à divers travaux de découpe et de finition. Que ce soit pour des projets de sculpture, d'assemblage ou de finitions délicates, ces ciseaux sont conçus pour assurer précision et confort. Leurs lames en acier de haute performance garantissent une longévité exemplaire, faisant d'eux un choix privilégié par les professionnels.

Un fait remarquable sur Marples est leur attention particulière portée à l'ergonomie et à la durabilité de leurs produits. La marque investit continuellement dans la recherche et le développement pour perfectionner ses outils, assurant ainsi que chaque artisan puisse travailler efficacement et avec plaisir. Cette philosophie fait de Marples un acteur incontournable dans le monde de l'outillage.","Découvrez les ciseaux à bois Marples chez Outillage Placide Mathieu. Offrez-vous des outils de qualité pour vos projets de menuiserie. Parfaits pour tous les artisans, ces ciseaux sont conçus pour durer. Visitez Placide.com."
fr,Speedbor,"Speedbor est une marque reconnue dans le domaine de l'outillage, fondée avec la mission de fournir des solutions innovantes et pratiques pour les professionnels du bois et les passionnés de bricolage. Depuis ses débuts, Speedbor s'est engagé à améliorer l'efficacité des travaux d'assemblage et de perçage en proposant des produits de qualité supérieure qui répondent aux besoins variés de ses utilisateurs.

La gamme d'outillage Speedbor comprend principalement des forets à bois, dotés de conceptions uniques permettant un perçage rapide et précis. Parmi leurs produits phares, on trouve des forets à pointe ""brad"", qui facilitent la pénétration dans le bois sans déviation, réduisant ainsi le risque d'éclats et assurant un fini poli. Que ce soit pour des travaux de menuiserie, d'ébénisterie ou des projets de bricolage, Speedbor propose des outils adaptés à toutes les exigences.

Un fait notable sur Speedbor est leur engagement envers l'innovation technologique et l'amélioration continue de leurs produits. En investissant dans la recherche et le développement, la marque a su se démarquer et devenir un incontournable pour les artisans à la recherche d'outils fiables et performants. Ce souci d'excellence fait de Speedbor un choix judicieux pour ceux qui souhaitent optimiser leur expérience de travail avec le bois.","Découvrez les forets à bois de la marque Speedbor, idéaux pour tous vos projets de perçage. Performants et durables, ils garantissent précision et rapidité. Améliorez vos outils avec Speedbor chez Outillage Placide Mathieu. Visitez Placide.com."
fr,Itm,"Itm est une marque reconnue pour son expertise dans le domaine de l'outillage. Fondée avec la vision de rendre accessible un matériel de qualité aux professionnels comme aux amateurs, Itm s'engage à fournir des produits fiables et performants. Leur mission est de développer des solutions adaptées aux besoins spécifiques des utilisateurs, en mettant l'accent sur l'innovation et la durabilité.

La gamme d'outillage proposée par Itm comprend une variété de forets en métal, notamment des modèles extra-longs adaptés à divers types de perçage. Ces outils sont conçus pour assurer une précision et une efficacité maximales, même dans des situations exigeantes. Que ce soit pour le travail du bois ou des métaux, leur catalogue répond à des besoins variés tout en garantissant une qualité supérieure.

Un fait marquant au sujet d’Itm est leur engagement envers la durabilité. La marque utilise des technologies de pointe dans la fabrication de ses produits, ce qui leur permet de réduire l'impact environnemental tout en offrant des outils de haute performance. De cette manière, Itm s'affirme non seulement comme un acteur clé de l'industrie, mais aussi comme un responsable écoresponsable dans le secteur de l'outillage.","Découvrez notre sélection de forets à métal extra-long de la marque Itm, conçus pour un perçage précis et efficace. Améliorez votre projet avec des outils de qualité supérieure. Visitez Placide.com."
fr,Jacobs Chuck,"Jacobs Chuck est une marque emblématique, reconnue pour son engagement envers l'innovation et la qualité dans le domaine de l'outillage. Fondée au début du XXe siècle, Jacobs est devenue un leader dans la fabrication de mandrins, visant à offrir des solutions qui facilitent le travail des professionnels et des passionnés de bricolage. Sa mission est d'assurer précision et fiabilité à travers des produits conçus pour répondre aux exigences des utilisateurs dans divers secteurs.

Les outils offerts par Jacobs Chuck incluent une large gamme de clés de mandrin, qui se distinguent par leur robustesse et leur facilité d'utilisation. Ces équipements sont essentiels pour tout atelier, permettant de maintenir une performance optimale lors de l'utilisation de perceuses et d'autres appareils électroportatifs. Avec des modèles adaptés à différentes tailles de forets, Jacobs s'assure que les bricoleurs disposent des outils nécessaires pour réaliser des travaux précis et efficaces.

Un fait remarquable concernant Jacobs Chuck est sa réputation pour l'innovation continue. Leurs produits intègrent des avancées technologiques qui améliorent la sécurité et l'efficacité des processus d'assemblage et de perçage. En choisissant Jacobs, les utilisateurs profitent non seulement de la qualité, mais aussi de l’héritage d’une marque qui a su s’adapter aux évolutions du marché sans jamais compromettre ses valeurs fondamentales.","Découvrez notre sélection de clés de mandrin Jacobs Chuck, idéales pour tous vos projets de bricolage. Performantes et fiables, elles sont conçues pour faciliter votre travail. Visitez Placide.com pour en savoir plus !"
fr,JACKFIELD,"Jackfield est une marque fondée avec la passion de fournir des outils de qualité aux professionnels et aux bricoleurs. Sa mission est d'offrir un éventail de produits qui allient durabilité et fonctionnalité, permettant à chacun de mener à bien ses projets sans compromis. En misant sur l'innovation et le savoir-faire, Jackfield s'est imposée comme un acteur incontournable dans l'univers de l'outillage.

La gamme proposée par Jackfield inclut une variété d'articles adaptés aux différents besoins des utilisateurs. Parmi ces produits, on trouve des pantalons de travail robustes et confortables, ainsi que des modèles imperméables, parfaits pour affronter des conditions climatiques variées. Chaque pièce est conçue pour allier ergonomie et résistance, garantissant un confort optimal pendant l'utilisation.

Un fait marquant sur Jackfield est son engagement envers la durabilité. La marque ne cesse d'innover pour réduire son empreinte écologique tout en offrant des produits de haute qualité. En intégrant des matériaux recyclés et des procédés de fabrication plus respectueux de l'environnement, Jackfield prouve que l'outillage peut être à la fois efficace et responsable.","Découvrez la qualité des pantalons de travail JACKFIELD, alliant confort et durabilité pour tous vos projets. Trouvez le modèle qui vous convient chez Outillage Placide Mathieu. Visitez Placide.com pour explorer notre sélection !"
fr,ITC,"ITC, ou Innovative Tools Company, a vu le jour avec une mission claire : fournir des outils de qualité supérieure qui allient performance et durabilité. Fondée par des passionnés d'outillage, la marque s'engage à améliorer l'expérience des utilisateurs, qu'ils soient professionnels ou amateurs. Son approche centrée sur l'innovation et l'efficacité a permis à ITC de se faire une place de choix sur le marché.

La gamme d'outillage proposée par ITC est variée et répond à différents besoins, allant des réservoirs d'air portables aux équipements plus spécialisés. Les produits, conçus avec une attention particulière aux détails, sont adaptés à un large éventail d'applications, offrant ainsi une solution fiable pour chaque projet, qu'il s'agisse de travaux domestiques ou de chantiers professionnels.

Un fait marquant à propos d'ITC est son engagement envers la durabilité, non seulement à travers la conception de produits robustes, mais aussi par des pratiques de fabrication respectueuses de l'environnement. Ce souci de l'impact écologique fait d'ITC un leader responsable dans l'industrie, attirant une clientèle soucieuse de faire des choix éclairés pour ses outils.","Découvrez les produits ITC chez Outillage Placide Mathieu : réservoirs d'air portables, compacts et performants, parfaits pour tous vos projets. Ne manquez pas notre sélection de qualité. Visitez Placide.com pour en savoir plus !"
fr,Jet,"Jet est une marque reconnue dans le monde de l'outillage, fondée avec l'objectif de fournir des produits de haute qualité et fiables pour les professionnels et les passionnés du bricolage. Depuis ses débuts, elle s'est engagée à concevoir des outils qui allient performance et durabilité, facilitant ainsi les tâches de chaque utilisateur au quotidien.

Dans sa large gamme de produits, Jet propose divers outils qui répondent à des besoins spécifiques dans différents domaines. Parmi son offre, on retrouve des pinces d'électricien, des pinces à long bec, ainsi que des pinces coupantes, toutes conçues pour offrir une prise en main optimale et une précision exemplaire. Les étaux de mécanique, quant à eux, sont disponibles en plusieurs tailles, adaptés aux travaux de précision ou aux besoins plus robustes, garantissant une stabilité parfaite lors de l'utilisation.

Un fait intéressant concernant Jet est son investissement continu dans la recherche et le développement. Au fil des ans, la marque a su intégrer des innovations techniques qui améliorent l'ergonomie et la fonctionnalité de ses outils. Cet engagement pour l'amélioration constante se reflète dans la satisfaction de ses utilisateurs, qui trouvent dans chaque produit Jet une solution efficace et pérenne pour réaliser leurs projets.","Découvrez notre sélection d'outils Jet, incluant des pinces d'électricien, pinces à long bec, pinces coupantes et étaux de mécanique. Des outils fiables pour tous vos projets. Visitez Placide.com pour en savoir plus !"
fr,Strongarm,"Strongarm est une marque reconnue dans le secteur de l'outillage, dont l'origine remonte à des décennies d'engagement envers l'innovation et la qualité. Sa mission principale est de fournir des outils fiables et durables, adaptés aux besoins des professionnels et des amateurs du bricolage. En se concentrant sur la sécurité et l’efficacité, Strongarm s'efforce d'offrir des produits qui facilitent les tâches tout en garantissant une utilisation optimale.

La gamme d'outils Strongarm se distingue par sa diversité, incluant des crics « bouteille » de différentes capacités, idéaux pour lever et soutenir des véhicules de manière sécuritaire. Que ce soit pour un usage à domicile ou dans un environnement professionnel, Strongarm propose également des accessoires tels que des boyaux hydrauliques et des grues d'atelier, tous conçus pour répondre à des normes de performance élevées. Chaque produit incarne l'engagement de la marque envers l'excellence.

Un fait marquant concernant Strongarm est sa réputation bien établie pour la robustesse de ses produits. Ils sont souvent préférés par les mécaniciens et les professionnels de l'industrie, ce qui témoigne de leur fiabilité sur le terrain. En intégrant des technologies avancées et des matériaux de qualité, Strongarm continue de se positionner comme un acteur majeur sur le marché de l'outillage.","Découvrez la robustesse et la fiabilité des crics ""bouteille"" Strongarm, conçus pour faciliter votre travail. Profitez de performances inégalées pour soulever vos charges en toute sécurité. Visitez Placide.com pour en savoir plus !"
fr,Startech,"Startech est une marque reconnue pour son engagement envers l'innovation et la qualité dans le domaine de l'outillage. Fondée sur des valeurs de durabilité et d'efficacité, la mission de Startech est de fournir aux professionnels et aux bricoleurs des produits fiables qui facilitent le travail quotidien. L'accent est mis sur la recherche constante de solutions adaptées aux besoins variés des utilisateurs.

La gamme d'outillage proposée par Startech couvre un large éventail de produits essentiels, allant des lampes de poche puissantes et des lampes frontales à des rallonges électriques et dévidoirs pratiques. Chaque article est conçu pour optimiser l'usage au quotidien, en garantissant performance et sécurité, qu'il s'agisse d'éclairer un espace de travail ou de prolonger l'accès à l'électricité.

Un fait saillant concernant Startech est son engagement envers la satisfaction client. Leurs produits sont soumis à des tests rigoureux pour garantir une qualité irréprochable, et la marque se fait un point d'honneur de recueillir les retours utilisateurs pour améliorer continuellement son offre. Cette attention portée à l'expérience client fait de Startech un choix privilégié parmi les professionnels de l'outillage.","Découvrez la gamme d'outils Startech chez Outillage Placide Mathieu, incluant lampes de poche et frontales, baladeuses et rallonges électriques. Qualité et performance au rendez-vous pour tous vos projets. Visitez Placide.com."
fr,Johnson,"Johnson est une marque reconnue pour son engagement envers la qualité et l'innovation dans le domaine de l'outillage. Fondée sur des principes d'intégrité et d'efficacité, elle vise à fournir des solutions pratiques pour les professionnels et les bricoleurs. La mission de Johnson est de simplifier les tâches quotidiennes en concevant des outils fiables qui répondent aux besoins variés de ses utilisateurs.

L'éventail des produits Johnson comprend des niveaux de surface, des outils de mesure et d'autres équipements indispensables pour garantir précision et fiabilité. Chaque article est minutieusement élaboré pour offrir une performance optimale, qu'il s'agisse de projets de construction, de rénovation ou de bricolage. L'accent est mis sur l'ergonomie et la robustesse, permettant aux utilisateurs d'accomplir leurs tâches en toute confiance.

Un fait remarquable sur Johnson est son héritage d'excellence technique. La marque est connue pour ses innovations qui ont redéfini les standards de l'industrie, en proposant des produits qui allient tradition artisanale et modernité technologique. Cela en fait un choix privilégié pour ceux qui recherchent des outils durables et performants, façonnés par des décennies d'expérience.","Découvrez les outils de la marque Johnson chez Outillage Placide Mathieu. Explorez notre gamme de niveaux de surface et d'autres outils de qualité, conçus pour les professionnels et les passionnés. Visitez Placide.com pour en savoir plus !"
fr,Jepson,"Jepson est une marque d'outillage reconnue pour son engagement envers la qualité et l'innovation. Fondée sur une passion pour l'amélioration des techniques de travail, elle aspire à fournir des solutions durables et efficaces aux professionnels et aux amateurs de bricolage. La mission de Jepson est de rendre les outils plus accessibles tout en garantissant des performances optimales, permettant ainsi à chaque utilisateur d’atteindre ses objectifs avec facilité.

La gamme d'outillage Jepson couvre une variété d'applications, allant des scies tronçonneuses aux scies circulaires, offrant des outils électriques adaptés à différentes tâches. Que ce soit pour un projet de menuiserie ou de metal, les produits comme la scie à onglets électrique et la scie circulaire 18V sont conçus pour offrir une précision exceptionnelle et une manipulation aisée, favorisant ainsi un travail efficace et rapide.

Un fait marquant au sujet de Jepson est son engagement envers la durabilité. La marque intègre des matériaux recyclables dans la fabrication de ses outils, faisant ainsi la promotion d'une approche respectueuse de l’environnement. Cette préoccupation pour la durabilité, tout en maintenant des standards de performance élevés, illustre leur volonté de contribuer positivement à la fois à l'industrie et à la planète.","Découvrez la gamme Jepson chez Outillage Placide Mathieu : scies tronçonneuses, scies à onglets et scies circulaires, conçues pour la performance et la précision. Améliorez vos projets avec nos outils de qualité. Visitez Placide.com."
fr,Kar,"La marque Kar a su s'imposer dans le domaine de l'outillage grâce à son engagement envers la qualité et l'innovation. Fondée avec la mission de fournir des outils fiables, Kar se consacre à l'amélioration des performances des professionnels. L'entreprise met un point d'honneur à répondre aux exigences des artisans et des bricoleurs en développant des produits adaptés aux besoins du marché.

Kar propose une large gamme d'outils, notamment des scies trépans bi-métal, qui se distinguent par leur robustesse et leur durabilité. Ces outils sont conçus pour faciliter le perçage dans divers matériaux, garantissant précision et efficacité. Les scies trépans Kar sont idéales pour réaliser des travaux de haute qualité tout en assurant une utilisation prolongée, même dans les conditions les plus exigeantes.

Un fait remarquable au sujet de Kar est son engagement envers l'environnement. En adoptant des méthodes de fabrication durables et en minimisant les déchets, la marque contribue à la préservation des ressources tout en offrant des outils qui répondent aux attentes des utilisateurs. Cela témoigne non seulement de son sérieux en matière de qualité, mais également de sa responsabilité sociale envers la planète.","Découvrez la qualité des outils Kar chez Outillage Placide Mathieu. Profitez de notre sélection de scies trépan bi-métal, idéales pour vos projets de bricolage. Fiabilité et performance au rendez-vous ! Visitez Placide.com."
fr,Shaviv,"Shaviv est une marque renommée qui a vu le jour en Israël, proposant des solutions d'ébavurage innovantes pour les professionnels. Sa mission est d'offrir des outils de haute qualité qui simplifient le travail des artisans et des entreprises industrielles, tout en garantissant une efficacité maximale et un confort d'utilisation. Depuis ses débuts, Shaviv se consacre à améliorer la productivité en fournissant des outils fiables qui répondent aux besoins variés de ses clients.

Parmi les produits emblématiques de Shaviv, on trouve une gamme diversifiée d'outils d'ébavurage, adaptés à des applications variées. Que ce soit pour éliminer les bavures sur des métaux ou préparer des surfaces avant une finition, les lames B et E se distinguent par leur performance et leur robustesse. Shaviv met un point d'honneur à concevoir des outils qui facilitent les tâches tout en offrant une durabilité accrue, permettant ainsi une utilisation sur le long terme.

Un fait marquant sur Shaviv est son engagement envers l'innovation continue. La marque investit régulièrement dans la recherche et le développement pour rester à la pointe des technologies d'outillage. Cela lui permet de répondre aux besoins changeants de l'industrie et d'améliorer sans cesse ses produits, faisant ainsi de Shaviv un acteur clé dans le domaine de l’ébavurage à travers le monde.","Découvrez les outils d'ébavurage de marque Shaviv, parfaits pour des finitions précises et professionnelles. Explorez notre sélection d'outils de qualité pour simplifier vos projets. Visitez Placide.com pour en savoir plus !"
fr,GearWrench,"GearWrench est une marque reconnue pour son engagement envers l'innovation et la qualité dans le domaine de l'outillage. Fondée avec la mission d'améliorer l'efficacité des professionnels et des passionnés, GearWrench s'est rapidement imposée comme un leader en proposant des solutions intelligentes et pratiques pour tous les types de travaux. Leur approche centrée sur l'utilisateur les distingue, visant à simplifier les tâches les plus complexes.

La gamme d'outils GearWrench est variée, incluant des douilles et rallonges conçues pour offrir robustesse et performance. Que ce soit pour des applications automobiles ou des projets de bricolage, leurs produits, tels que les douilles Vortex, sont conçus pour assurer un couple optimal et un ajustement parfait. Chaque outil reflète leur dévouement à la qualité et à la précision, garantissant ainsi une expérience utilisateur optimale.

Un fait intéressant concernant GearWrench est qu'ils sont des pionniers dans le développement de l'outil à douille à revêtement rotatif, une innovation qui permet de travailler plus rapidement et efficacement. Cette technologie unique illustre leur capacité à écouter les besoins des utilisateurs et à répondre avec des solutions qui transforment le quotidien des professionnels.","Découvrez la qualité des douilles Vortex de GearWrench, conçues pour une prise optimale et une durabilité exceptionnelle. Parfaites pour vos projets d'outillage. Visitez Placide.com pour explorer notre sélection complète !"
fr,GEARWRENCH,"GEARWRENCH est une marque reconnue dans l'univers de l'outillage, fondée avec la mission de fournir des solutions innovantes pour les professionnels de l'automobile et de la mécanique. Elle se fixe comme objectif d’améliorer l’efficacité et la productivité des utilisateurs à travers des outils bien conçus qui répondent aux besoins spécifiques des métiers techniques. La marque incarne l'engagement envers la qualité et l’innovation, en développant des produits qui facilitent les tâches tout en garantissant la durabilité.

GEARWRENCH offre une vaste gamme d'outils, allant des clés mécaniques aux tournevis, en passant par des outils spécialisés comme des clés à filtreur, adaptées pour différents types de réparations et d'assemblages. Chaque produit est conçu avec précision pour assurer une manipulation facile et efficace, permettant aux professionnels d'accomplir leur travail avec confiance. Les utilisateurs peuvent s'attendre à des outils qui mêlent ergonomie, robustesse et technologie de pointe pour un résultat optimal.

Un fait marquant à propos de GEARWRENCH est son engagement fort envers l'innovation. La marque investit continuellement dans la recherche et le développement, ce qui lui permet de lancer régulièrement des outils dotés de caractéristiques avancées, comme des mécanismes de verrouillage améliorés ou des designs ergonomiques. Cela fait de GEARWRENCH un fournisseur de choix pour ceux qui recherchent des outils à la fois performants et fiables.","Découvrez notre gamme d'outils GEARWRENCH, spécialement conçus pour répondre à tous vos besoins en mécanique. Performance et qualité au rendez-vous pour un travail facilité. Visitez Placide.com pour explorer nos produits !"
